\echo "=== Test: Worker Structured Concurrency ==="
"=== Test: Worker Structured Concurrency ==="
\echo "Verifies parent-child task relationships, waiting state, and automatic completion"
"Verifies parent-child task relationships, waiting state, and automatic completion"
BEGIN;
-- Lock worker.tasks to prevent the background worker from advancing the sequence
-- during the test. This ensures deterministic task IDs in error messages.
LOCK TABLE worker.tasks IN EXCLUSIVE MODE;
-- Canonical worker.tasks baseline: clean slate + freshly-seeded maint pair.
-- Tests get predictable maint at ids 1, 2; subsequent inserts at id=3+.
-- Same shape as a fresh production install. The historical id-7 collision
-- from accumulated completed maint rows (migration 20260422161000 seeds
-- pending stubs; worker transitions them to completed and re-enqueues at
-- later sequence values) is gone because we DELETE everything and
-- re-enqueue from scratch.
DELETE FROM worker.tasks;
ALTER SEQUENCE worker.tasks_id_seq RESTART WITH 1;
SELECT worker.enqueue_task_cleanup();         -- INSERTs at id=1 (no conflict, fresh table)
 enqueue_task_cleanup 
----------------------
                    1
(1 row)

SELECT worker.enqueue_import_job_cleanup();   -- INSERTs at id=2 (no conflict, fresh table)
 enqueue_import_job_cleanup 
----------------------------
                          2
(1 row)

-- Sequence is now at 3 implicitly; test inserts continue from there.
\echo "=== 1. Verify task_state enum includes 'waiting' ==="
"=== 1. Verify task_state enum includes 'waiting' ==="
SELECT unnest(enum_range(NULL::worker.task_state)) AS state ORDER BY state;
    state    
-------------
 pending
 processing
 interrupted
 waiting
 completed
 failed
(6 rows)

\echo "=== 2. Verify tasks table has required columns ==="
"=== 2. Verify tasks table has required columns ==="
SELECT column_name, data_type 
FROM information_schema.columns 
WHERE table_schema = 'worker' AND table_name = 'tasks' 
  AND column_name IN ('parent_id', 'completed_at')
ORDER BY column_name;
 column_name  |        data_type         
--------------+--------------------------
 completed_at | timestamp with time zone
 parent_id    | bigint
(2 rows)

\echo "=== 3. Verify structured concurrency functions exist ==="
"=== 3. Verify structured concurrency functions exist ==="
SELECT routine_name, routine_type
FROM information_schema.routines
WHERE routine_schema = 'worker'
  AND routine_name IN ('spawn', 'has_pending_children', 'has_failed_siblings', 'complete_parent_if_ready')
ORDER BY routine_name;
       routine_name       | routine_type 
--------------------------+--------------
 complete_parent_if_ready | FUNCTION
 has_failed_siblings      | FUNCTION
 has_pending_children     | FUNCTION
 spawn                    | FUNCTION
(4 rows)

\echo "=== 4. Verify no-grandchildren trigger removed (recursive spawning enabled) ==="
"=== 4. Verify no-grandchildren trigger removed (recursive spawning enabled) ==="
SELECT tgname, tgtype, tgenabled
FROM pg_trigger
WHERE tgname = 'tasks_enforce_no_grandchildren';
 tgname | tgtype | tgenabled 
--------+--------+-----------
(0 rows)

\echo "=== 5. Test spawn function creates parent-child relationship ==="
"=== 5. Test spawn function creates parent-child relationship ==="
-- Create a parent task
INSERT INTO worker.tasks (command, payload, state)
VALUES ('derive_statistical_unit', '{}', 'processing')
RETURNING id AS parent_task_id \gset
-- Spawn a child task using the spawn function
SELECT worker.spawn(
    p_command => 'statistical_unit_refresh_batch',
    p_payload => '{"batch_seq": 1}'::jsonb,
    p_parent_id => :parent_task_id,
    p_priority => 20
) AS child_task_id \gset
-- Verify child has correct parent relationship (not specific IDs)
SELECT 
    command,
    parent_id = :parent_task_id AS has_correct_parent,
    priority,
    state
FROM worker.tasks
WHERE id = :child_task_id;
            command             | has_correct_parent | priority |  state  
--------------------------------+--------------------+----------+---------
 statistical_unit_refresh_batch | t                  |       20 | pending
(1 row)

\echo "=== 6. Test has_pending_children function ==="
"=== 6. Test has_pending_children function ==="
-- Parent should have pending children
SELECT worker.has_pending_children(:parent_task_id) AS has_pending;
 has_pending 
-------------
 t
(1 row)

-- Mark child as completed
UPDATE worker.tasks SET state = 'completed', completed_at = now() WHERE id = :child_task_id;
-- Now parent should NOT have pending children
SELECT worker.has_pending_children(:parent_task_id) AS has_pending_after_complete;
 has_pending_after_complete 
----------------------------
 f
(1 row)

\echo "=== 7. Test complete_parent_if_ready function ==="
"=== 7. Test complete_parent_if_ready function ==="
-- Set parent to waiting state (simulating what process_tasks does)
UPDATE worker.tasks SET state = 'waiting' WHERE id = :parent_task_id;
-- Call complete_parent_if_ready - should complete the parent
SELECT worker.complete_parent_if_ready(:child_task_id) AS parent_completed;
 parent_completed 
------------------
 t
(1 row)

-- Verify parent is now completed
SELECT command, state, completed_at IS NOT NULL AS has_completed_at
FROM worker.tasks
WHERE id = :parent_task_id;
         command         |   state   | has_completed_at 
-------------------------+-----------+------------------
 derive_statistical_unit | completed | t
(1 row)

\echo "=== 8. Test recursive task spawning (grandchildren allowed) ==="
"=== 8. Test recursive task spawning (grandchildren allowed) ==="
-- Create a new parent and child
INSERT INTO worker.tasks (command, payload, state)
VALUES ('derive_statistical_unit', '{}', 'waiting')
RETURNING id AS new_parent_id \gset
INSERT INTO worker.tasks (command, payload, parent_id, state)
VALUES ('statistical_unit_refresh_batch', '{}', :new_parent_id, 'processing')
RETURNING id AS new_child_id \gset
-- Create a grandchild using spawn (should succeed with recursive spawning)
SELECT worker.spawn(
    p_command => 'statistical_unit_refresh_batch',
    p_payload => '{"nested": true}'::jsonb,
    p_parent_id => :new_child_id,
    p_priority => 20
) AS grandchild_id \gset
-- Verify grandchild has correct depth (parent at depth 0 via direct INSERT, so grandchild = 1)
SELECT depth FROM worker.tasks WHERE id = :grandchild_id;
 depth 
-------
     1
(1 row)

-- Clean up grandchild for remaining tests
DELETE FROM worker.tasks WHERE id = :grandchild_id;
\echo "=== 9. Test sibling spawning (child can spawn siblings with same parent) ==="
"=== 9. Test sibling spawning (child can spawn siblings with same parent) ==="
-- Child should be able to spawn a sibling (same parent_id)
SELECT worker.spawn(
    p_command => 'statistical_unit_refresh_batch',
    p_payload => '{"batch_seq": 2, "spawned_by_sibling": true}'::jsonb,
    p_parent_id => :new_parent_id,
    p_priority => 20
) AS sibling_task_id \gset
-- Verify sibling exists with correct parent (not specific IDs)
SELECT 
    command,
    parent_id = :new_parent_id AS has_same_parent,
    payload->>'spawned_by_sibling' AS spawned_by_sibling
FROM worker.tasks
WHERE id = :sibling_task_id;
            command             | has_same_parent | spawned_by_sibling 
--------------------------------+-----------------+--------------------
 statistical_unit_refresh_batch | t               | true
(1 row)

\echo "=== 10. Test uncle spawning (child can spawn top-level task) ==="
"=== 10. Test uncle spawning (child can spawn top-level task) ==="
-- Child should be able to spawn an "uncle" (parent_id = NULL)
SELECT worker.spawn(
    p_command => 'derive_reports',
    p_payload => '{}'::jsonb,
    p_parent_id => NULL,
    p_priority => 30
) AS uncle_task_id \gset
-- Verify uncle is top-level
SELECT command, parent_id IS NULL AS is_top_level, priority
FROM worker.tasks
WHERE id = :uncle_task_id;
    command     | is_top_level | priority 
----------------+--------------+----------
 derive_reports | t            |       30
(1 row)

\echo "=== 11. Test has_failed_siblings function ==="
"=== 11. Test has_failed_siblings function ==="
-- Create another child and mark it as failed
INSERT INTO worker.tasks (command, payload, parent_id, state, completed_at, error)
VALUES ('statistical_unit_refresh_batch', '{"will_fail": true}', :new_parent_id, 'failed', now(), 'Test failure')
RETURNING id AS failed_child_id \gset
-- Check if siblings detect the failure
SELECT worker.has_failed_siblings(:sibling_task_id) AS has_failed_sibling;
 has_failed_sibling 
--------------------
 t
(1 row)

\echo "=== 12. Test parent fails when child fails ==="
"=== 12. Test parent fails when child fails ==="
-- Mark all pending children as completed
UPDATE worker.tasks 
SET state = 'completed', completed_at = now() 
WHERE parent_id = :new_parent_id AND state = 'pending';
-- Complete the processing child
UPDATE worker.tasks 
SET state = 'completed', completed_at = now() 
WHERE id = :new_child_id;
-- Now call complete_parent_if_ready - parent should FAIL because one child failed
SELECT worker.complete_parent_if_ready(:new_child_id) AS triggered_parent_completion;
 triggered_parent_completion 
-----------------------------
 t
(1 row)

-- Verify parent is failed
SELECT command, state, error
FROM worker.tasks
WHERE id = :new_parent_id;
         command         | state  |             error              
-------------------------+--------+--------------------------------
 derive_statistical_unit | failed | One or more child tasks failed
(1 row)

\echo "=== 13. Summary of task relationships created (excluding maintenance) ==="
"=== 13. Summary of task relationships created (excluding maintenance) ==="
SELECT 
    command,
    state,
    CASE 
        WHEN parent_id IS NULL THEN 'root'
        ELSE 'child'
    END AS task_type,
    (SELECT COUNT(*) FROM worker.tasks c WHERE c.parent_id = t.id) AS child_count
FROM worker.tasks t
WHERE command NOT IN ('task_cleanup', 'import_job_cleanup')
ORDER BY 
    CASE command 
        WHEN 'derive_statistical_unit' THEN 1
        WHEN 'statistical_unit_refresh_batch' THEN 2
        WHEN 'derive_reports' THEN 3
    END,
    state,
    task_type;
            command             |   state   | task_type | child_count 
--------------------------------+-----------+-----------+-------------
 derive_statistical_unit        | completed | root      |           1
 derive_statistical_unit        | failed    | root      |           3
 statistical_unit_refresh_batch | completed | child     |           0
 statistical_unit_refresh_batch | completed | child     |           0
 statistical_unit_refresh_batch | completed | child     |           0
 statistical_unit_refresh_batch | failed    | child     |           0
 derive_reports                 | pending   | root      |           0
(7 rows)

-- ============================================================================
-- CHILD_MODE TESTS
-- ============================================================================
\echo "=== 13a. Test spawn() sets child_mode to concurrent by default ==="
"=== 13a. Test spawn() sets child_mode to concurrent by default ==="
-- Clean slate for child_mode tests
DELETE FROM worker.tasks WHERE id > 2;
ALTER SEQUENCE worker.tasks_id_seq RESTART WITH 3;
INSERT INTO worker.tasks (command, payload, state)
VALUES ('derive_statistical_unit', '{}', 'processing')
RETURNING id AS cm_parent_id \gset
-- Spawn without explicit child_mode
SELECT worker.spawn(
    p_command => 'statistical_unit_refresh_batch',
    p_payload => '{"cm_test": 1}'::jsonb,
    p_parent_id => :cm_parent_id,
    p_priority => 10
) AS cm_child1_id \gset
SELECT child_mode FROM worker.tasks WHERE id = :cm_parent_id;
 child_mode 
------------
 concurrent
(1 row)

\echo "=== 13b. Test spawn() with explicit serial child_mode ==="
"=== 13b. Test spawn() with explicit serial child_mode ==="
DELETE FROM worker.tasks WHERE id > 2;
ALTER SEQUENCE worker.tasks_id_seq RESTART WITH 3;
INSERT INTO worker.tasks (command, payload, state)
VALUES ('derive_statistical_unit', '{}', 'processing')
RETURNING id AS cm_serial_parent_id \gset
SELECT worker.spawn(
    p_command => 'statistical_unit_refresh_batch',
    p_payload => '{"cm_test": 2}'::jsonb,
    p_parent_id => :cm_serial_parent_id,
    p_priority => 10,
    p_child_mode => 'serial'
) AS cm_serial_child_id \gset
SELECT child_mode FROM worker.tasks WHERE id = :cm_serial_parent_id;
 child_mode 
------------
 serial
(1 row)

\echo "=== 13c. Test second spawn preserves existing child_mode ==="
"=== 13c. Test second spawn preserves existing child_mode ==="
-- Spawn a second child without explicit mode — should NOT change the parent's serial mode
SELECT worker.spawn(
    p_command => 'statistical_unit_refresh_batch',
    p_payload => '{"cm_test": 3}'::jsonb,
    p_parent_id => :cm_serial_parent_id,
    p_priority => 11
) AS cm_serial_child2_id \gset
SELECT child_mode FROM worker.tasks WHERE id = :cm_serial_parent_id;
 child_mode 
------------
 serial
(1 row)

\echo "=== 13d. Test spawn() with conflicting child_mode raises exception ==="
"=== 13d. Test spawn() with conflicting child_mode raises exception ==="
SAVEPOINT before_conflict;
\set ON_ERROR_STOP off
-- Parent already has child_mode='serial', requesting 'concurrent' should fail
SELECT worker.spawn(
    p_command => 'statistical_unit_refresh_batch',
    p_payload => '{"cm_test": 4}'::jsonb,
    p_parent_id => :cm_serial_parent_id,
    p_priority => 12,
    p_child_mode => 'concurrent'
);
ERROR:  Parent task 3 already has child_mode=serial, cannot set to concurrent
CONTEXT:  PL/pgSQL function worker.spawn(text,jsonb,bigint,bigint,worker.child_mode) line 40 at RAISE
\set ON_ERROR_STOP on
ROLLBACK TO SAVEPOINT before_conflict;
\echo "=== 13e. Test depth is 1 for children spawned from depth-0 parent ==="
"=== 13e. Test depth is 1 for children spawned from depth-0 parent ==="
SELECT depth FROM worker.tasks WHERE id = :cm_serial_child_id;
 depth 
-------
     1
(1 row)

-- Clean up child_mode test data
DELETE FROM worker.tasks WHERE id > 2;
ALTER SEQUENCE worker.tasks_id_seq RESTART WITH 3;
-- ============================================================================
-- INTEGRATION TESTS: process_tasks with parent-child relationships
-- ============================================================================
\echo "=== 14. Test process_tasks: parent transitions to waiting when children spawned ==="
"=== 14. Test process_tasks: parent transitions to waiting when children spawned ==="
-- Clean slate for integration tests
DELETE FROM worker.tasks WHERE id > 2;
ALTER SEQUENCE worker.tasks_id_seq RESTART WITH 3;
-- Create a parent task that will spawn children
INSERT INTO worker.tasks (command, payload, state)
VALUES ('derive_statistical_unit', '{}', 'pending')
RETURNING id AS int_parent_id \gset
-- Manually spawn children (simulating what the handler would do)
INSERT INTO worker.tasks (command, payload, parent_id, state)
VALUES 
    ('statistical_unit_refresh_batch', '{"batch": 1}', :int_parent_id, 'pending'),
    ('statistical_unit_refresh_batch', '{"batch": 2}', :int_parent_id, 'pending');
-- Simulate process_tasks picking the parent: mark it processing
UPDATE worker.tasks SET state = 'processing', worker_pid = pg_backend_pid() WHERE id = :int_parent_id;
-- After handler runs and we detect children exist, parent should go to waiting
-- (This is what process_tasks does internally)
UPDATE worker.tasks 
SET state = 'waiting', process_start_at = now(), process_stop_at = now()
WHERE id = :int_parent_id;
-- Verify parent is now waiting with 2 pending children
SELECT 
    (SELECT state FROM worker.tasks WHERE id = :int_parent_id) AS parent_state,
    (SELECT COUNT(*) FROM worker.tasks WHERE parent_id = :int_parent_id AND state = 'pending') AS pending_children;
 parent_state | pending_children 
--------------+------------------
 waiting      |                2
(1 row)

\echo "=== 15. Test process_tasks: concurrent mode picks children of waiting parent ==="
"=== 15. Test process_tasks: concurrent mode picks children of waiting parent ==="
-- When there's a waiting parent, process_tasks should pick its children
-- Simulate picking first child (use subquery since UPDATE doesn't support LIMIT)
UPDATE worker.tasks 
SET state = 'processing', worker_pid = pg_backend_pid()
WHERE id = (
    SELECT id FROM worker.tasks 
    WHERE parent_id = :int_parent_id AND state = 'pending' 
    ORDER BY id LIMIT 1
);
-- Verify one child is processing
SELECT 
    (SELECT COUNT(*) FROM worker.tasks WHERE parent_id = :int_parent_id AND state = 'processing') AS processing_children,
    (SELECT COUNT(*) FROM worker.tasks WHERE parent_id = :int_parent_id AND state = 'pending') AS pending_children;
 processing_children | pending_children 
---------------------+------------------
                   1 |                1
(1 row)

\echo "=== 16. Test process_tasks: completing children triggers parent completion ==="
"=== 16. Test process_tasks: completing children triggers parent completion ==="
-- Complete both children
UPDATE worker.tasks 
SET state = 'completed', completed_at = now()
WHERE parent_id = :int_parent_id;
-- Call complete_parent_if_ready (this is what process_tasks calls after each child completes)
SELECT worker.complete_parent_if_ready(
    (SELECT id FROM worker.tasks WHERE parent_id = :int_parent_id LIMIT 1)
) AS parent_completed;
 parent_completed 
------------------
 t
(1 row)

-- Verify parent is now completed
SELECT state, completed_at IS NOT NULL AS has_completed_at
FROM worker.tasks 
WHERE id = :int_parent_id;
   state   | has_completed_at 
-----------+------------------
 completed | t
(1 row)

\echo "=== 17. Test process_tasks: serial mode when no waiting parent ==="
"=== 17. Test process_tasks: serial mode when no waiting parent ==="
-- Create a top-level task (no waiting parents exist)
INSERT INTO worker.tasks (command, payload, state)
VALUES ('derive_reports', '{}', 'pending')
RETURNING id AS serial_task_id \gset
-- Verify there's no waiting parent
SELECT COUNT(*) AS waiting_parents FROM worker.tasks WHERE state = 'waiting';
 waiting_parents 
-----------------
               0
(1 row)

-- In serial mode, process_tasks would pick this top-level pending task
SELECT command, state, parent_id IS NULL AS is_top_level
FROM worker.tasks
WHERE id = :serial_task_id;
    command     |  state  | is_top_level 
----------------+---------+--------------
 derive_reports | pending | t
(1 row)

\echo "=== 18. Final state summary ==="
"=== 18. Final state summary ==="
SELECT 
    command,
    state,
    CASE WHEN parent_id IS NULL THEN 'root' ELSE 'child' END AS task_type
FROM worker.tasks
WHERE command NOT IN ('task_cleanup', 'import_job_cleanup')
ORDER BY id;
            command             |   state   | task_type 
--------------------------------+-----------+-----------
 derive_statistical_unit        | completed | root
 statistical_unit_refresh_batch | completed | child
 statistical_unit_refresh_batch | completed | child
 derive_reports                 | pending   | root
(4 rows)

\echo "=== 18b. Test rescue_stuck_waiting_parent with zero children ==="
"=== 18b. Test rescue_stuck_waiting_parent with zero children ==="
-- Clean slate for rescue test
DELETE FROM worker.tasks WHERE id > 2;
ALTER SEQUENCE worker.tasks_id_seq RESTART WITH 3;
-- Create a task and manually force it into waiting with no children
INSERT INTO worker.tasks (command, payload, state)
VALUES ('derive_statistical_unit', '{}', 'waiting')
RETURNING id AS stuck_parent_id \gset
-- Verify it has no children
SELECT COUNT(*) AS child_count FROM worker.tasks WHERE parent_id = :stuck_parent_id;
 child_count 
-------------
           0
(1 row)

-- Rescue should find and force-fail this stuck parent
SELECT worker.rescue_stuck_waiting_parent('analytics') AS rescued_id \gset
-- Verify parent is now failed with descriptive error
SELECT state, error
FROM worker.tasks
WHERE id = :stuck_parent_id;
 state  |                  error                   
--------+------------------------------------------
 failed | Stuck waiting with no children (rescued)
(1 row)

-- Clean up
DELETE FROM worker.tasks WHERE id > 2;
ALTER SEQUENCE worker.tasks_id_seq RESTART WITH 3;
-- Tests 19-21 removed: enqueue_derive_statistical_unit() and per-command
-- dedup indexes were dropped in the serial child tree migration.
-- Deduplication now happens via collect_changes (top-level only).
ROLLBACK;
