BEGIN;
\i test/setup.sql
-- While the datestyle is set for the database, the pg_regress tool sets the MDY format
-- to ensure consistent date formatting, so we must manually override this
SET datestyle TO 'ISO, DMY';
\if :{?DEBUG}
SET client_min_messages TO debug1;
\else
SET client_min_messages TO NOTICE;
\endif
-- Create temporary function to execute queries as system user
CREATE OR REPLACE FUNCTION test.sudo_exec(
    sql text,
    OUT results jsonb
) RETURNS jsonb
SECURITY DEFINER LANGUAGE plpgsql AS $sudo_exec$
DECLARE
    result_rows jsonb;
BEGIN
    -- Check if the SQL starts with common DDL keywords
    IF sql ~* '^\s*(CREATE|DROP|ALTER|TRUNCATE|GRANT|REVOKE|ANALYZE)' THEN
        -- For DDL statements, execute directly
        EXECUTE sql;
        results := '[]'::jsonb;
    ELSE
        -- For DML/queries, wrap in a SELECT to capture results
        EXECUTE format('
            SELECT COALESCE(
                jsonb_agg(row_to_json(t)),
                ''[]''::jsonb
            )
            FROM (%s) t',
            sql
        ) INTO result_rows;
        results := result_rows;
    END IF;
END;
$sudo_exec$;
-- Grant execute to public since this is for testing
GRANT EXECUTE ON FUNCTION test.sudo_exec(text) TO PUBLIC;
\echo Add users for testing purposes
Add users for testing purposes
SELECT * FROM public.user_create(p_display_name => 'Test Admin', p_email => 'test.admin@statbus.org', p_statbus_role => 'admin_user'::statbus_role, p_password => 'Admin#123!');
         email          |  password  
------------------------+------------
 test.admin@statbus.org | Admin#123!
(1 row)

SELECT * FROM public.user_create(p_display_name => 'Test Regular', p_email => 'test.regular@statbus.org', p_statbus_role => 'regular_user'::statbus_role, p_password => 'Regular#123!');
          email           |   password   
--------------------------+--------------
 test.regular@statbus.org | Regular#123!
(1 row)

SELECT * FROM public.user_create(p_display_name => 'Test Restricted', p_email => 'test.restricted@statbus.org', p_statbus_role => 'restricted_user'::statbus_role, p_password => 'Restricted#123!');
            email            |    password     
-----------------------------+-----------------
 test.restricted@statbus.org | Restricted#123!
(1 row)

CREATE OR REPLACE PROCEDURE test.remove_pg_temp_for_tx_user_switch(p_keep_tables text[] DEFAULT '{}')
LANGUAGE plpgsql
AS $remove_pg_temp_for_tx_user_switch$
DECLARE
    rec record;
    v_found_count integer := 0;
BEGIN
    RAISE DEBUG 'Running test.remove_pg_temp_for_tx_user_switch(p_keep_tables => %)...', p_keep_tables;
    -- Remove temporary cache tables used by import, as we switch user inside the *same* transaction,
    -- and the new user can not modify tables owned by the previous import.
    -- This generic loop cleans up all tables and views in the pg_temp schema, except those specified to keep.
    FOR rec IN
        SELECT
            c.relname,
            c.relkind
        FROM pg_catalog.pg_class AS c
        LEFT JOIN pg_catalog.pg_namespace AS n ON n.oid = c.relnamespace
        WHERE c.relkind IN ('r', 'p', 'v', 'm') AND n.oid = pg_my_temp_schema() -- r=table, p=partitioned, v=view, m=materialized
          AND c.relname <> ALL(p_keep_tables)
    LOOP
        v_found_count := v_found_count + 1;
        IF rec.relkind IN ('r', 'p', 'm') THEN
            RAISE DEBUG '  -> Dropping temp TABLE %', rec.relname;
            EXECUTE format('DROP TABLE IF EXISTS pg_temp.%I CASCADE', rec.relname);
        ELSIF rec.relkind = 'v' THEN
            RAISE DEBUG '  -> Dropping temp VIEW %', rec.relname;
            EXECUTE format('DROP VIEW IF EXISTS pg_temp.%I CASCADE', rec.relname);
        END IF;
    END LOOP;

    RAISE DEBUG '...finished test.remove_pg_temp_for_tx_user_switch(). Found and dropped % objects.', v_found_count;

    -- This procedure is part of the sql_saga extension and has its own cleanup logic.
    -- While the loop above handles tables/views, this call ensures any other temporary
    -- objects it creates are also cleaned up.
    CALL sql_saga.temporal_merge_drop_temp_tables();
END;
$remove_pg_temp_for_tx_user_switch$;
-- This test verifies that an UPDATE on a temporal table correctly triggers
-- the worker to refresh the statistical_unit materialized view.
-- 1. Load initial data using the import system (ported from 306_load_demo_data.sql)
-- 2. Check the initial state of a statistical unit.
-- 3. Perform an UPDATE on a related `activity` record.
-- 4. Verify that a `check_table` task is enqueued in worker.tasks.
-- 5. Process the tasks.
-- 6. Verify that the statistical unit has been updated with the new data.
-- A Super User configures statbus.
CALL test.set_user_from_email('test.admin@statbus.org');
\i samples/demo/getting-started.sql
-- Set the activity category standard to ISIC v4 for the demo data.
\echo "User selected the Activity Category Standard"
"User selected the Activity Category Standard"
INSERT INTO settings(activity_category_standard_id,country_id)
SELECT (SELECT id FROM activity_category_standard WHERE code = 'isic_v4')
     , (SELECT id FROM public.country WHERE iso_2 = 'UN')
ON CONFLICT (only_one_setting)
DO UPDATE SET
    activity_category_standard_id = EXCLUDED.activity_category_standard_id,
    country_id = EXCLUDED.country_id;
\echo "User uploads the demo activity categories"
"User uploads the demo activity categories"
\copy public.activity_category_available_custom(path,name) FROM 'app/public/demo/activity_custom_isic_demo.csv' WITH (FORMAT csv, DELIMITER ',', QUOTE '"', HEADER true);
\echo "User uploads the demo regions"
"User uploads the demo regions"
\copy public.region_upload(path, name) FROM 'app/public/demo/regions_demo.csv' WITH (FORMAT csv, DELIMITER ',', QUOTE '"', HEADER true);
\echo "User uploads the demo sectors"
"User uploads the demo sectors"
\copy public.sector_custom_only(path,name,description) FROM 'app/public/demo/sectors_demo.csv' WITH (FORMAT csv, DELIMITER ',', QUOTE '"', HEADER true);
\echo "User uploads the demo legal forms"
"User uploads the demo legal forms"
\copy public.legal_form_custom_only(code,name) FROM 'app/public/demo/legal_forms_demo.csv' WITH (FORMAT csv, DELIMITER ',', QUOTE '"', HEADER true);
-- The demo data uses data sources that are part of the core database seed.
-- This file is included for structural consistency with other sample data sets.
-- Create Import Job for Legal Units (Demo CSV)
INSERT INTO public.import_job (definition_id, slug, description, note, edit_comment, time_context_ident)
SELECT
    (SELECT id FROM public.import_definition WHERE slug = 'legal_unit_job_provided'),
    'import_13_lu',
    'Import LU Demo CSV (313_update_triggers_refresh.sql)',
    'Import job for app/public/demo/legal_units_demo.csv using legal_unit_job_provided definition.',
    'Test data load (313_update_triggers_refresh.sql)',
    'r_year_curr';
\echo "User uploads the sample legal units (via import job: import_13_lu)"
"User uploads the sample legal units (via import job: import_13_lu)"
\copy public.import_13_lu_upload(tax_ident,stat_ident,name,birth_date,physical_region_code,physical_country_iso_2,primary_activity_category_code,legal_form_code,sector_code,employees,turnover,data_source_code) FROM 'app/public/demo/legal_units_demo.csv' WITH (FORMAT csv, DELIMITER ',', QUOTE '"', HEADER true);
-- Create Import Job for Formal Establishments (Demo CSV)
INSERT INTO public.import_job (definition_id, slug, description, note, edit_comment, time_context_ident)
SELECT
    (SELECT id FROM public.import_definition WHERE slug = 'establishment_for_lu_job_provided'),
    'import_13_esflu',
    'Import Formal ES Demo CSV (313_update_triggers_refresh.sql)',
    'Import job for app/public/demo/formal_establishments_units_demo.csv using establishment_for_lu_job_provided definition.',
    'Test data load (313_update_triggers_refresh.sql)',
    'r_year_curr';
\echo "User uploads the sample formal establishments (via import job: import_13_esflu)"
"User uploads the sample formal establishments (via import job: import_13_esflu)"
\copy public.import_13_esflu_upload(tax_ident,stat_ident,name,physical_region_code,physical_country_iso_2,primary_activity_category_code,employees,turnover,legal_unit_tax_ident,data_source_code) FROM 'app/public/demo/formal_establishments_units_demo.csv' WITH (FORMAT csv, DELIMITER ',', QUOTE '"', HEADER true);
-- Create Import Job for Informal Establishments (Demo CSV)
INSERT INTO public.import_job (definition_id, slug, description, note, edit_comment, time_context_ident)
SELECT
    (SELECT id FROM public.import_definition WHERE slug = 'establishment_without_lu_job_provided'),
    'import_13_eswlu',
    'Import Informal ES Demo CSV (313_update_triggers_refresh.sql)',
    'Import job for app/public/demo/informal_establishments_units_demo.csv using establishment_without_lu_job_provided definition.',
    'Test data load (313_update_triggers_refresh.sql)',
    'r_year_curr';
\echo "User uploads the sample informal establishments (via import job: import_13_eswlu)"
"User uploads the sample informal establishments (via import job: import_13_eswlu)"
\copy public.import_13_eswlu_upload(tax_ident,stat_ident,name,physical_region_code,physical_country_iso_2,primary_activity_category_code,employees,turnover,data_source_code) FROM 'app/public/demo/informal_establishments_units_demo.csv' WITH (FORMAT csv, DELIMITER ',', QUOTE '"', HEADER true);
\echo Run worker processing for import jobs
Run worker processing for import jobs
CALL worker.process_tasks(p_queue => 'import');
\echo Run worker processing for analytics tasks
Run worker processing for analytics tasks
CALL worker.process_tasks(p_queue => 'analytics');
-- 
SELECT unit_type, external_idents, valid_from, valid_until, name, stats->'employees' as employees FROM public.statistical_unit
WHERE name = 'Statistics Norway'
ORDER BY unit_type, unit_id, valid_from, valid_until;
   unit_type   |                 external_idents                 | valid_from | valid_until |       name        | employees 
---------------+-------------------------------------------------+------------+-------------+-------------------+-----------
 establishment | {"tax_ident": "94711111", "stat_ident": "1021"} | 2025-01-01 | infinity    | Statistics Norway | 0
 legal_unit    | {"tax_ident": "4711111", "stat_ident": "230"}   | 2025-01-01 | infinity    | Statistics Norway | 1
 enterprise    | {"tax_ident": "4711111", "stat_ident": "230"}   | 2025-01-01 | infinity    | Statistics Norway | 
(3 rows)

\echo "Initial data loaded. All subsequent tests will check the worker response to an UPDATE on a specific temporal table."
"Initial data loaded. All subsequent tests will check the worker response to an UPDATE on a specific temporal table."
--------------------------------------------------------------------------------
\echo "--- TEST 1: UPDATE on stat_for_unit ---"
"--- TEST 1: UPDATE on stat_for_unit ---"
--------------------------------------------------------------------------------
\echo "Before: Checking stats for 'Statistics Norway' legal unit"
"Before: Checking stats for 'Statistics Norway' legal unit"
\x
SELECT external_idents, name, stats->'employees' as employees
FROM public.statistical_unit
WHERE name = 'Statistics Norway' AND unit_type = 'legal_unit'
AND valid_from <= current_date AND current_date < valid_until;
-[ RECORD 1 ]---+----------------------------------------------
external_idents | {"tax_ident": "4711111", "stat_ident": "230"}
name            | Statistics Norway
employees       | 1

\x
\echo "Action: Updating a stat_for_unit record for 'Statistics Norway' legal unit"
"Action: Updating a stat_for_unit record for 'Statistics Norway' legal unit"
UPDATE public.stat_for_unit
SET value_int = 100
WHERE legal_unit_id = (SELECT id FROM public.legal_unit WHERE name = 'Statistics Norway')
AND stat_definition_id = (SELECT id FROM public.stat_definition WHERE code = 'employees');
\echo "Check: Expect one 'check_table' task for 'stat_for_unit'."
"Check: Expect one 'check_table' task for 'stat_for_unit'."
SELECT command, payload->>'table_name' as table_name, state
FROM worker.tasks
WHERE command = 'check_table' AND state = 'pending';
   command   |  table_name   |  state  
-------------+---------------+---------
 check_table | stat_for_unit | pending
(1 row)

\echo "Run worker to process tasks..."
"Run worker to process tasks..."
CALL worker.process_tasks(p_queue => 'analytics'); -- Processes check_table, enqueues derive tasks and process derived tasks
\echo "After: check stats for 'Statistics Norway'. Expect employees to be 100."
"After: check stats for 'Statistics Norway'. Expect employees to be 100."
\x
SELECT external_idents, name, stats->'employees' as employees
FROM public.statistical_unit
WHERE name = 'Statistics Norway' AND unit_type = 'legal_unit'
AND valid_from <= current_date AND current_date < valid_until;
-[ RECORD 1 ]---+----------------------------------------------
external_idents | {"tax_ident": "4711111", "stat_ident": "230"}
name            | Statistics Norway
employees       | 100

\x
--------------------------------------------------------------------------------
\echo "--- TEST 2: UPDATE on establishment ---"
"--- TEST 2: UPDATE on establishment ---"
--------------------------------------------------------------------------------
\echo "Before: Checking name for establishment 'Statistics Norway'"
"Before: Checking name for establishment 'Statistics Norway'"
SELECT name FROM public.statistical_unit WHERE name = 'Statistics Norway' AND unit_type = 'establishment';
       name        
-------------------
 Statistics Norway
(1 row)

\echo "Action: Updating establishment name"
"Action: Updating establishment name"
UPDATE public.establishment SET name = 'Statistics Norway Updated' WHERE name = 'Statistics Norway';
\echo "Check: Expect one 'check_table' task for 'establishment'."
"Check: Expect one 'check_table' task for 'establishment'."
SELECT command, payload->>'table_name' as table_name, state FROM worker.tasks WHERE command = 'check_table' AND state = 'pending';
   command   |  table_name   |  state  
-------------+---------------+---------
 check_table | establishment | pending
(1 row)

\echo "Run worker to process tasks..."
"Run worker to process tasks..."
CALL worker.process_tasks(p_queue => 'analytics');
\echo "After: Checking name for establishment 'Statistics Norway Updated'"
"After: Checking name for establishment 'Statistics Norway Updated'"
SELECT name FROM public.statistical_unit WHERE name = 'Statistics Norway Updated' AND unit_type = 'establishment';
           name            
---------------------------
 Statistics Norway Updated
(1 row)

--------------------------------------------------------------------------------
\echo "--- TEST 3: UPDATE on legal_unit ---"
"--- TEST 3: UPDATE on legal_unit ---"
--------------------------------------------------------------------------------
\echo "Before: Checking name of enterprise for legal_unit 'Statistics Norway'"
"Before: Checking name of enterprise for legal_unit 'Statistics Norway'"
SELECT name FROM public.statistical_unit WHERE unit_type = 'enterprise' AND unit_id = (SELECT enterprise_id FROM public.legal_unit WHERE name = 'Statistics Norway');
       name        
-------------------
 Statistics Norway
(1 row)

\echo "Action: Updating legal_unit short_name"
"Action: Updating legal_unit short_name"
UPDATE public.legal_unit SET short_name = 'GIL' WHERE name = 'Statistics Norway';
\echo "Check: Expect one 'check_table' task for 'legal_unit'."
"Check: Expect one 'check_table' task for 'legal_unit'."
SELECT command, payload->>'table_name' as table_name, state FROM worker.tasks WHERE command = 'check_table' AND state = 'pending';
   command   | table_name |  state  
-------------+------------+---------
 check_table | legal_unit | pending
(1 row)

\echo "Run worker to process tasks..."
"Run worker to process tasks..."
CALL worker.process_tasks(p_queue => 'analytics');
\echo "After: Checking name of enterprise for legal_unit 'Statistics Norway'. Expect 'GIL'."
"After: Checking name of enterprise for legal_unit 'Statistics Norway'. Expect 'GIL'."
SELECT name FROM public.statistical_unit WHERE unit_type = 'enterprise' AND unit_id = (SELECT enterprise_id FROM public.legal_unit WHERE name = 'Statistics Norway');
       name        
-------------------
 Statistics Norway
(1 row)

--------------------------------------------------------------------------------
\echo "--- TEST 4: UPDATE on location ---"
"--- TEST 4: UPDATE on location ---"
--------------------------------------------------------------------------------
\echo "Before: Checking physical_address_part1 for 'Statistics Norway'"
"Before: Checking physical_address_part1 for 'Statistics Norway'"
SELECT physical_address_part1 FROM public.statistical_unit WHERE name = 'Statistics Norway' AND unit_type = 'legal_unit';
 physical_address_part1 
------------------------
 
(1 row)

\echo "Action: Updating location address_part1"
"Action: Updating location address_part1"
UPDATE public.location SET address_part1 = '123 New Street' WHERE legal_unit_id = (SELECT id FROM public.legal_unit WHERE name = 'Statistics Norway');
\echo "Check: Expect one 'check_table' task for 'location'."
"Check: Expect one 'check_table' task for 'location'."
SELECT command, payload->>'table_name' as table_name, state FROM worker.tasks WHERE command = 'check_table' AND state = 'pending';
   command   | table_name |  state  
-------------+------------+---------
 check_table | location   | pending
(1 row)

\echo "Run worker to process tasks..."
"Run worker to process tasks..."
CALL worker.process_tasks(p_queue => 'analytics');
\echo "After: Checking physical_address_part1 for 'Statistics Norway'"
"After: Checking physical_address_part1 for 'Statistics Norway'"
SELECT physical_address_part1 FROM public.statistical_unit WHERE name = 'Statistics Norway' AND unit_type = 'legal_unit';
 physical_address_part1 
------------------------
 123 New Street
(1 row)

--------------------------------------------------------------------------------
\echo "--- TEST 5: UPDATE on activity ---"
"--- TEST 5: UPDATE on activity ---"
--------------------------------------------------------------------------------
\echo "Before: Checking primary_activity_category_path for 'Statistics Norway'"
"Before: Checking primary_activity_category_path for 'Statistics Norway'"
SELECT primary_activity_category_path FROM public.statistical_unit WHERE name = 'Statistics Norway' AND unit_type = 'legal_unit';
 primary_activity_category_path 
--------------------------------
 J.63.1.2.1
(1 row)

\echo "Action: Updating activity category_id"
"Action: Updating activity category_id"
UPDATE public.activity
SET category_id = (SELECT id FROM public.activity_category_available WHERE path = 'A.01')
WHERE legal_unit_id = (SELECT id FROM public.legal_unit WHERE name = 'Statistics Norway')
  AND type = 'primary';
\echo "Check: Expect one 'check_table' task for 'activity'."
"Check: Expect one 'check_table' task for 'activity'."
SELECT command, payload->>'table_name' as table_name, state FROM worker.tasks WHERE command = 'check_table' AND state = 'pending';
   command   | table_name |  state  
-------------+------------+---------
 check_table | activity   | pending
(1 row)

\echo "Run worker to process tasks..."
"Run worker to process tasks..."
CALL worker.process_tasks(p_queue => 'analytics');
\echo "After: Checking primary_activity_category_path for 'Statistics Norway'"
"After: Checking primary_activity_category_path for 'Statistics Norway'"
SELECT primary_activity_category_path FROM public.statistical_unit WHERE name = 'Statistics Norway' AND unit_type = 'legal_unit';
 primary_activity_category_path 
--------------------------------
 A.01
(1 row)

--------------------------------------------------------------------------------
\echo "--- TEST 6: UPDATE on contact ---"
"--- TEST 6: UPDATE on contact ---"
--------------------------------------------------------------------------------
\echo "Before: Checking email_address for 'Statistics Norway' (is null as no contact exists yet)"
"Before: Checking email_address for 'Statistics Norway' (is null as no contact exists yet)"
SELECT valid_from, valid_until, email_address FROM public.statistical_unit WHERE name = 'Statistics Norway' AND unit_type = 'legal_unit';
 valid_from | valid_until | email_address 
------------+-------------+---------------
 2025-01-01 | infinity    | 
(1 row)

\echo "Action: INSERT a new contact and then UPDATE it to test trigger."
"Action: INSERT a new contact and then UPDATE it to test trigger."
-- The demo data does not include contacts, so we insert one to be able to test the UPDATE trigger.
INSERT INTO public.contact (legal_unit_id, email_address, valid_from, valid_to, edit_by_user_id)
SELECT
    lu.id,
    'test@example.com',
    '2025-01-01',
    'infinity',
    (SELECT u.id FROM auth.user u WHERE u.email = 'test.admin@statbus.org')
FROM public.legal_unit lu WHERE lu.name = 'Statistics Norway';
UPDATE public.contact
SET email_address = 'updated.test@example.com'
WHERE legal_unit_id = (SELECT id FROM public.legal_unit WHERE name = 'Statistics Norway');
\echo "Check: Expect one 'check_table' task for 'contact' (coalesced from INSERT and UPDATE)."
"Check: Expect one 'check_table' task for 'contact' (coalesced from INSERT and UPDATE)."
SELECT command, payload->>'table_name' as table_name, state FROM worker.tasks WHERE command = 'check_table' AND state = 'pending';
   command   | table_name |  state  
-------------+------------+---------
 check_table | contact    | pending
(1 row)

\echo "Run worker to process tasks..."
"Run worker to process tasks..."
CALL worker.process_tasks(p_queue => 'analytics');
\echo "After: Checking email_address for 'Statistics Norway' (should be updated)"
"After: Checking email_address for 'Statistics Norway' (should be updated)"
SELECT email_address FROM public.statistical_unit WHERE name = 'Statistics Norway' AND unit_type = 'legal_unit';
      email_address       
--------------------------
 updated.test@example.com
(1 row)

--------------------------------------------------------------------------------
\echo "--- TEST 7: UPDATE on enterprise ---"
"--- TEST 7: UPDATE on enterprise ---"
--------------------------------------------------------------------------------
\echo "Before: Checking name of enterprise for 'Statistics Norway'"
"Before: Checking name of enterprise for 'Statistics Norway'"
-- Note: the enterprise is implicitly created and named after the first legal unit.
SELECT name FROM public.statistical_unit
WHERE unit_type = 'enterprise'
  AND unit_id = (SELECT enterprise_id FROM public.legal_unit WHERE name = 'Statistics Norway');
       name        
-------------------
 Statistics Norway
(1 row)

\echo "Action: Updating enterprise name directly"
"Action: Updating enterprise name directly"
UPDATE public.enterprise
SET short_name = 'SSB'
WHERE id = (SELECT enterprise_id FROM public.legal_unit WHERE name = 'Statistics Norway');
\echo "Check: Expect one 'check_table' task for 'enterprise'."
"Check: Expect one 'check_table' task for 'enterprise'."
SELECT command, payload->>'table_name' as table_name, state FROM worker.tasks WHERE command = 'check_table' AND state = 'pending';
   command   | table_name |  state  
-------------+------------+---------
 check_table | enterprise | pending
(1 row)

\echo "Run worker to process tasks..."
"Run worker to process tasks..."
CALL worker.process_tasks(p_queue => 'analytics');
\echo "After: Checking name of enterprise. Expect 'SSB'."
"After: Checking name of enterprise. Expect 'SSB'."
SELECT name FROM public.statistical_unit
WHERE name = 'SSB' AND unit_type = 'enterprise'
  AND unit_id = (SELECT enterprise_id FROM public.legal_unit WHERE name = 'Statistics Norway');
 name 
------
 SSB
(1 row)

--------------------------------------------------------------------------------
\echo "--- TEST 8: UPDATE on external_ident ---"
"--- TEST 8: UPDATE on external_ident ---"
--------------------------------------------------------------------------------
\echo "Before: Checking external_idents for 'Statistics Norway' legal unit"
"Before: Checking external_idents for 'Statistics Norway' legal unit"
\x
SELECT external_idents FROM public.statistical_unit WHERE name = 'Statistics Norway' AND unit_type = 'legal_unit';
-[ RECORD 1 ]---+----------------------------------------------
external_idents | {"tax_ident": "4711111", "stat_ident": "230"}

\x
\echo "Action: Updating external_ident.ident for 'Statistics Norway' legal unit"
"Action: Updating external_ident.ident for 'Statistics Norway' legal unit"
UPDATE public.external_ident
SET ident = '947111110'
WHERE legal_unit_id = (SELECT id FROM public.legal_unit WHERE name = 'Statistics Norway')
  AND type_id = (SELECT id FROM public.external_ident_type WHERE code = 'tax_ident');
\echo "Check: Expect one 'check_table' task for 'external_ident'."
"Check: Expect one 'check_table' task for 'external_ident'."
SELECT command, payload->>'table_name' as table_name, state FROM worker.tasks WHERE command = 'check_table' AND state = 'pending';
   command   |   table_name   |  state  
-------------+----------------+---------
 check_table | external_ident | pending
(1 row)

\echo "Run worker to process tasks..."
"Run worker to process tasks..."
CALL worker.process_tasks(p_queue => 'analytics');
\echo "After: check external_idents for 'Statistics Norway'. Expect updated tax_ident."
"After: check external_idents for 'Statistics Norway'. Expect updated tax_ident."
\x
SELECT external_idents FROM public.statistical_unit WHERE name = 'Statistics Norway' AND unit_type = 'legal_unit';
-[ RECORD 1 ]---+------------------------------------------------
external_idents | {"tax_ident": "947111110", "stat_ident": "230"}

\x
--------------------------------------------------------------------------------
\echo "--- TEST 9: UPDATE establishment parent (legal_unit_id) ---"
"--- TEST 9: UPDATE establishment parent (legal_unit_id) ---"
--------------------------------------------------------------------------------
\echo "Before: Checking parent of establishment 'Statistics Norway Updated'"
"Before: Checking parent of establishment 'Statistics Norway Updated'"
SELECT lu.name as legal_unit_name
FROM public.statistical_unit su_es
JOIN public.timeline_establishment tes ON su_es.unit_id = tes.unit_id AND su_es.valid_from = tes.valid_from
JOIN public.legal_unit lu ON tes.legal_unit_id = lu.id
WHERE su_es.name = 'Statistics Norway Updated'
  AND su_es.unit_type = 'establishment'
  AND su_es.valid_from <= current_date AND current_date < su_es.valid_until;
  legal_unit_name  
-------------------
 Statistics Norway
(1 row)

\echo "Action: Clear pending tasks, unset primary status, then update establishment's legal_unit_id"
"Action: Clear pending tasks, unset primary status, then update establishment's legal_unit_id"
DELETE FROM worker.tasks WHERE state = 'pending';
UPDATE public.establishment
SET primary_for_legal_unit = false
WHERE name = 'Statistics Norway Updated';
UPDATE public.establishment
SET legal_unit_id = (SELECT id FROM public.legal_unit WHERE name = 'Statistics Denmark')
WHERE name = 'Statistics Norway Updated';
\echo "Check: Expect 'check_table' for 'establishment' and 'enqueue_deleted_row' for the old parent."
"Check: Expect 'check_table' for 'establishment' and 'enqueue_deleted_row' for the old parent."
SELECT command, payload->>'table_name' as table_name, state
FROM worker.tasks
WHERE state = 'pending'
ORDER BY command;
   command   |  table_name   |  state  
-------------+---------------+---------
 check_table | establishment | pending
 deleted_row | establishment | pending
(2 rows)

\echo "Run worker to process tasks..."
"Run worker to process tasks..."
CALL worker.process_tasks(p_queue => 'analytics');
\echo "After: Checking new parent of establishment 'Statistics Norway Updated'. Expect 'Statistics Denmark'."
"After: Checking new parent of establishment 'Statistics Norway Updated'. Expect 'Statistics Denmark'."
SELECT lu.name as legal_unit_name
FROM public.statistical_unit su_es
JOIN public.timeline_establishment tes ON su_es.unit_id = tes.unit_id AND su_es.valid_from = tes.valid_from
JOIN public.legal_unit lu ON tes.legal_unit_id = lu.id
WHERE su_es.name = 'Statistics Norway Updated' AND su_es.unit_type = 'establishment'
  AND su_es.valid_from <= current_date AND current_date < su_es.valid_until;
  legal_unit_name   
--------------------
 Statistics Denmark
(1 row)

--------------------------------------------------------------------------------
\echo "--- TEST 10: UPDATE external_ident parent (legal_unit_id) ---"
"--- TEST 10: UPDATE external_ident parent (legal_unit_id) ---"
--------------------------------------------------------------------------------
\echo "Clear pending tasks to isolate test case"
"Clear pending tasks to isolate test case"
DELETE FROM worker.tasks WHERE state = 'pending';
\echo "Before: Checking external_idents for 'Statistics Ethiopia' and 'Statistics Sweden'"
"Before: Checking external_idents for 'Statistics Ethiopia' and 'Statistics Sweden'"
\x
SELECT name, external_idents FROM public.statistical_unit WHERE name IN ('Statistics Ethiopia', 'Statistics Sweden') AND unit_type = 'legal_unit' ORDER BY name;
-[ RECORD 1 ]---+-------------------------------------------
name            | Statistics Ethiopia
external_idents | {"tax_ident": "22501", "stat_ident": "18"}
-[ RECORD 2 ]---+-------------------------------------------
name            | Statistics Sweden
external_idents | {"tax_ident": "46001", "stat_ident": "15"}

\x
\echo "Action (1): Delete stat_ident for 'Statistics Ethiopia'"
"Action (1): Delete stat_ident for 'Statistics Ethiopia'"
DELETE FROM public.external_ident
WHERE legal_unit_id = (SELECT id FROM public.legal_unit WHERE name = 'Statistics Ethiopia')
  AND type_id = (SELECT id FROM public.external_ident_type WHERE code = 'stat_ident')
  AND ident = '18';
\echo "Check: Expect 'enqueue_deleted_row' for the parent LU."
"Check: Expect 'enqueue_deleted_row' for the parent LU."
-- The DELETE will trigger enqueue_deleted_row for the parent LU.
SELECT command, payload->>'table_name' as table_name, state
FROM worker.tasks
WHERE state = 'pending'
ORDER BY command;
   command   |   table_name   |  state  
-------------+----------------+---------
 deleted_row | external_ident | pending
(1 row)

\echo "Run worker to process tasks..."
"Run worker to process tasks..."
CALL worker.process_tasks(p_queue => 'analytics');
\echo "After (1): Check 'Statistics Ethiopia'. Expect stat_ident to be gone."
"After (1): Check 'Statistics Ethiopia'. Expect stat_ident to be gone."
\x
SELECT name, external_idents FROM public.statistical_unit WHERE name = 'Statistics Ethiopia' AND unit_type = 'legal_unit';
-[ RECORD 1 ]---+-----------------------
name            | Statistics Ethiopia
external_idents | {"tax_ident": "22501"}

\x
\echo "Action (2): Move stat_ident from 'Statistics Sweden' to 'Statistics Ethiopia'"
"Action (2): Move stat_ident from 'Statistics Sweden' to 'Statistics Ethiopia'"
UPDATE public.external_ident
SET legal_unit_id = (SELECT id FROM public.legal_unit WHERE name = 'Statistics Ethiopia')
WHERE legal_unit_id = (SELECT id FROM public.legal_unit WHERE name = 'Statistics Sweden')
  AND type_id = (SELECT id FROM public.external_ident_type WHERE code = 'stat_ident')
  AND ident = '15';
\echo "Check: Expect 'check_table' for 'external_ident' and 'enqueue_deleted_row' for old parent."
"Check: Expect 'check_table' for 'external_ident' and 'enqueue_deleted_row' for old parent."
-- The UPDATE on legal_unit_id will trigger enqueue_deleted_row for the OLD parent LU,
-- and the generic trigger will call check_table for external_ident.
SELECT command, payload->>'table_name' as table_name, state
FROM worker.tasks
WHERE state = 'pending'
ORDER BY command;
   command   |   table_name   |  state  
-------------+----------------+---------
 check_table | external_ident | pending
 deleted_row | external_ident | pending
(2 rows)

\echo "Run worker to process tasks..."
"Run worker to process tasks..."
CALL worker.process_tasks(p_queue => 'analytics');
\echo "After (2): Checking external_idents for both units. Ethiopia should have stat_ident 15, Sweden should not."
"After (2): Checking external_idents for both units. Ethiopia should have stat_ident 15, Sweden should not."
\x
SELECT name, external_idents FROM public.statistical_unit WHERE name IN ('Statistics Ethiopia', 'Statistics Sweden') AND unit_type = 'legal_unit' ORDER BY name;
-[ RECORD 1 ]---+-------------------------------------------
name            | Statistics Ethiopia
external_idents | {"tax_ident": "22501", "stat_ident": "15"}
-[ RECORD 2 ]---+-------------------------------------------
name            | Statistics Sweden
external_idents | {"tax_ident": "46001"}

\x
ROLLBACK;
