BEGIN;
\i test/setup.sql
-- While the datestyle is set for the database, the pg_regress tool sets the MDY format
-- to ensure consistent date formatting, so we must manually override this
SET datestyle TO 'ISO, DMY';
\if :{?DEBUG}
SET client_min_messages TO debug1;
\else
SET client_min_messages TO NOTICE;
\endif
-- Create temporary function to execute queries as system user
CREATE OR REPLACE FUNCTION test.sudo_exec(
    sql text,
    OUT results jsonb
) RETURNS jsonb
SECURITY DEFINER LANGUAGE plpgsql AS $sudo_exec$
DECLARE
    result_rows jsonb;
BEGIN
    -- Check if the SQL starts with common DDL keywords
    IF sql ~* '^\s*(CREATE|DROP|ALTER|TRUNCATE|GRANT|REVOKE|ANALYZE)' THEN
        -- For DDL statements, execute directly
        EXECUTE sql;
        results := '[]'::jsonb;
    ELSE
        -- For DML/queries, wrap in a SELECT to capture results
        EXECUTE format('
            SELECT COALESCE(
                jsonb_agg(row_to_json(t)),
                ''[]''::jsonb
            )
            FROM (%s) t',
            sql
        ) INTO result_rows;
        results := result_rows;
    END IF;
END;
$sudo_exec$;
-- Grant execute to public since this is for testing
GRANT EXECUTE ON FUNCTION test.sudo_exec(text) TO PUBLIC;
\echo Add users for testing purposes
Add users for testing purposes
SELECT * FROM public.user_create('test.admin@statbus.org', 'admin_user'::statbus_role, 'Admin#123!');
         email          |  password  
------------------------+------------
 test.admin@statbus.org | Admin#123!
(1 row)

SELECT * FROM public.user_create('test.regular@statbus.org', 'regular_user'::statbus_role, 'Regular#123!');
          email           |   password   
--------------------------+--------------
 test.regular@statbus.org | Regular#123!
(1 row)

SELECT * FROM public.user_create('test.restricted@statbus.org', 'restricted_user'::statbus_role, 'Restricted#123!');
            email            |    password     
-----------------------------+-----------------
 test.restricted@statbus.org | Restricted#123!
(1 row)

\echo "Setting up Statbus using the web provided examples"
"Setting up Statbus using the web provided examples"
-- A Super User configures statbus.
CALL test.set_user_from_email('test.admin@statbus.org');
\echo "User selected the Activity Category Standard"
"User selected the Activity Category Standard"
INSERT INTO settings(activity_category_standard_id,only_one_setting)
SELECT id, true FROM activity_category_standard WHERE code = 'isic_v4'
ON CONFLICT (only_one_setting)
DO UPDATE SET
   activity_category_standard_id =(SELECT id FROM activity_category_standard WHERE code = 'isic_v4')
   WHERE settings.id = EXCLUDED.id;
;
\echo "User uploads the sample activity categories"
"User uploads the sample activity categories"
\copy public.activity_category_available_custom(path,name) FROM 'app/public/demo/activity_custom_isic_demo.csv' WITH (FORMAT csv, DELIMITER ',', QUOTE '"', HEADER true);
\echo "User uploads the sample regions"
"User uploads the sample regions"
\copy public.region_upload(path, name) FROM 'app/public/demo/regions_demo.csv' WITH (FORMAT csv, DELIMITER ',', QUOTE '"', HEADER true);
\echo "User uploads the sample legal forms"
"User uploads the sample legal forms"
\copy public.legal_form_custom_only(code,name) FROM 'app/public/demo/legal_forms_demo.csv' WITH (FORMAT csv, DELIMITER ',', QUOTE '"', HEADER true);
\echo "User uploads the sample sectors"
"User uploads the sample sectors"
\copy public.sector_custom_only(path,name,description) FROM 'app/public/demo/sectors_demo.csv' WITH (FORMAT csv, DELIMITER ',', QUOTE '"', HEADER true);
SAVEPOINT before_loading_units;
SELECT
    (SELECT COUNT(DISTINCT id) AS distinct_unit_count FROM public.establishment) AS establishment_count,
    (SELECT COUNT(DISTINCT id) AS distinct_unit_count FROM public.legal_unit) AS legal_unit_count,
    (SELECT COUNT(DISTINCT id) AS distinct_unit_count FROM public.enterprise) AS enterprise_count;
 establishment_count | legal_unit_count | enterprise_count 
---------------------+------------------+------------------
                   0 |                0 |                0
(1 row)

-- Create Import Job for Legal Units
INSERT INTO public.import_job (definition_id, slug, description, note, edit_comment)
SELECT
    (SELECT id FROM public.import_definition WHERE slug = 'legal_unit_source_dates'),
    'import_315_lu_era',
    'Import Legal Units Era (315_activity_for_portion_of_valid.sql)',
    'Import job for legal units from test/data/03_norwegian-legal-units-over-time.csv using legal_unit_source_dates definition.',
    'Test data load (315_activity_for_portion_of_valid.sql)';
\echo "User uploads the legal units over time (via import job: import_315_lu_era)"
"User uploads the legal units over time (via import job: import_315_lu_era)"
\copy public.import_315_lu_era_upload(stat_ident,name,primary_activity_category_code,valid_from,valid_to) FROM 'test/data/315_activity_for_portion_of_valid.csv' WITH (FORMAT csv, DELIMITER ',', QUOTE '"', HEADER true);
\echo Run worker processing for import jobs
Run worker processing for import jobs
--SET client_min_messages TO DEBUG1;
CALL worker.process_tasks(p_queue => 'import');
--SET client_min_messages TO NOTICE;
SELECT queue, state, count(*) FROM worker.tasks AS t JOIN worker.command_registry AS c ON t.command = c.command WHERE c.queue != 'maintenance' GROUP BY queue,state ORDER BY queue,state;
   queue   |   state   | count 
-----------+-----------+-------
 analytics | pending   |     4
 import    | completed |    47
(2 rows)

\echo "Checking unit counts after import processing"
"Checking unit counts after import processing"
SELECT
    (SELECT COUNT(DISTINCT id) AS distinct_unit_count FROM public.establishment) AS establishment_count,
    (SELECT COUNT(DISTINCT id) AS distinct_unit_count FROM public.legal_unit) AS legal_unit_count,
    (SELECT COUNT(DISTINCT id) AS distinct_unit_count FROM public.enterprise) AS enterprise_count;
 establishment_count | legal_unit_count | enterprise_count 
---------------------+------------------+------------------
                   0 |                1 |                1
(1 row)

\echo "Inspecting import job data for import_315_lu_era"
"Inspecting import job data for import_315_lu_era"
SELECT row_id, state, errors, stat_ident_raw, name_raw, data_source_code_raw, merge_status
FROM public.import_315_lu_era_data
ORDER BY row_id
LIMIT 5;
 row_id |   state   | errors | stat_ident_raw |         name_raw         | data_source_code_raw |                       merge_status                       
--------+-----------+--------+----------------+--------------------------+----------------------+----------------------------------------------------------
      1 | processed | {}     | 1              | ENTEBBE FUEL ENTERPRISES |                      | {"legal_unit": "APPLIED", "primary_activity": "APPLIED"}
(1 row)

\echo "Checking import job status for import_315_lu_era"
"Checking import job status for import_315_lu_era"
SELECT slug, state, total_rows, imported_rows, error IS NOT NULL AS has_error,
       (SELECT COUNT(*) FROM public.import_315_lu_era_data dr WHERE dr.state = 'error') AS error_rows
FROM public.import_job
WHERE slug = 'import_315_lu_era'
ORDER BY slug;
       slug        |  state   | total_rows | imported_rows | has_error | error_rows 
-------------------+----------+------------+---------------+-----------+------------
 import_315_lu_era | finished |          1 |             1 | f         |          0
(1 row)

\echo Run worker processing for analytics tasks
Run worker processing for analytics tasks
CALL worker.process_tasks(p_queue => 'analytics');
SELECT queue, state, count(*) FROM worker.tasks AS t JOIN worker.command_registry AS c ON t.command = c.command WHERE c.queue != 'maintenance' GROUP BY queue,state ORDER BY queue,state;
   queue   |   state   | count 
-----------+-----------+-------
 analytics | completed |     6
 import    | completed |    47
(2 rows)

\echo "Checking legal unit"
"Checking legal unit"
SELECT name, valid_from, valid_to
 FROM legal_unit
 ORDER BY valid_from;
           name           | valid_from |  valid_to  
--------------------------+------------+------------
 ENTEBBE FUEL ENTERPRISES | 2023-01-01 | 2025-12-31
(1 row)

SELECT category_id, valid_from, valid_to
 FROM activity
 ORDER BY  valid_from;
 category_id | valid_from |  valid_to  
-------------+------------+------------
          13 | 2023-01-01 | 2025-12-31
(1 row)

SAVEPOINT before_update_on_activity;
\echo "Update using valid_until"
"Update using valid_until"
UPDATE activity__for_portion_of_valid
 SET category_id = '30', valid_from = '2024-01-01', valid_until = '2025-01-01'
 WHERE legal_unit_id = (SELECT id FROM public.legal_unit WHERE name = 'ENTEBBE FUEL ENTERPRISES');
TABLE pg_temp.temporal_merge_plan ORDER BY plan_op_seq;
 plan_op_seq | row_ids | operation | update_effect | causal_id | is_new_entity |                                entity_keys                                 | identity_keys |                            lookup_keys                            | s_t_relation | b_a_relation | old_valid_from | old_valid_until | new_valid_from | new_valid_until |                                                                                                         data                                                                                                         | feedback | trace |    grouping_key    
-------------+---------+-----------+---------------+-----------+---------------+----------------------------------------------------------------------------+---------------+-------------------------------------------------------------------+--------------+--------------+----------------+-----------------+----------------+-----------------+----------------------------------------------------------------------------------------------------------------------------------------------------------------------------------------------------------------------+----------+-------+--------------------
           1 | {1}     | INSERT    |               | 1         | f             | {"id": 1, "type": "primary", "legal_unit_id": 1, "establishment_id": null} | {"id": 1}     | {"type": "primary", "legal_unit_id": 1, "establishment_id": null} | during       | contains     | 2023-01-01     | 2026-01-01      | 2024-01-01     | 2025-01-01      | {"edit_at": "2025-10-07T03:56:18.001658-07:00", "valid_to": "2024-12-31", "category_id": 30, "edit_comment": "Test data load (315_activity_for_portion_of_valid.sql)", "data_source_id": null, "edit_by_user_id": 4} |          |       | existing_entity__1
           2 | {1}     | INSERT    |               | 1         | f             | {"id": 1, "type": "primary", "legal_unit_id": 1, "establishment_id": null} | {"id": 1}     | {"type": "primary", "legal_unit_id": 1, "establishment_id": null} | during       | finished_by  | 2023-01-01     | 2026-01-01      | 2025-01-01     | 2026-01-01      | {"edit_at": "2025-10-07T03:56:18.001658-07:00", "valid_to": "2025-12-31", "category_id": 13, "edit_comment": "Test data load (315_activity_for_portion_of_valid.sql)", "data_source_id": null, "edit_by_user_id": 4} |          |       | existing_entity__1
           3 | {1}     | UPDATE    | SHRINK        | 1         | f             | {"id": 1, "type": "primary", "legal_unit_id": 1, "establishment_id": null} | {"id": 1}     | {"type": "primary", "legal_unit_id": 1, "establishment_id": null} | during       | started_by   | 2023-01-01     | 2026-01-01      | 2023-01-01     | 2024-01-01      | {"edit_at": "2025-10-07T03:56:18.001658-07:00", "valid_to": "2023-12-31", "category_id": 13, "edit_comment": "Test data load (315_activity_for_portion_of_valid.sql)", "data_source_id": null, "edit_by_user_id": 4} |          |       | existing_entity__1
(3 rows)

SELECT category_id, valid_from, valid_to
 FROM activity
 ORDER BY  valid_from;
 category_id | valid_from |  valid_to  
-------------+------------+------------
          13 | 2023-01-01 | 2023-12-31
          30 | 2024-01-01 | 2024-12-31
          13 | 2025-01-01 | 2025-12-31
(3 rows)

ROLLBACK TO before_update_on_activity;
SELECT category_id, valid_from, valid_to
 FROM activity
 ORDER BY  valid_from;
 category_id | valid_from |  valid_to  
-------------+------------+------------
          13 | 2023-01-01 | 2025-12-31
(1 row)

-- SET sql_saga.temporal_merge.enable_trace = true;
\echo "Update using valid_to"
"Update using valid_to"
UPDATE activity__for_portion_of_valid
 SET category_id = '30', valid_from = '2024-01-01', valid_to = '2024-12-31'
 WHERE legal_unit_id = (SELECT id FROM public.legal_unit WHERE name = 'ENTEBBE FUEL ENTERPRISES');
TABLE pg_temp.temporal_merge_plan ORDER BY plan_op_seq;
 plan_op_seq | row_ids | operation | update_effect | causal_id | is_new_entity |                                entity_keys                                 | identity_keys |                            lookup_keys                            | s_t_relation | b_a_relation | old_valid_from | old_valid_until | new_valid_from | new_valid_until |                                                                                                         data                                                                                                         | feedback | trace |    grouping_key    
-------------+---------+-----------+---------------+-----------+---------------+----------------------------------------------------------------------------+---------------+-------------------------------------------------------------------+--------------+--------------+----------------+-----------------+----------------+-----------------+----------------------------------------------------------------------------------------------------------------------------------------------------------------------------------------------------------------------+----------+-------+--------------------
           1 | {1}     | INSERT    |               | 1         | f             | {"id": 1, "type": "primary", "legal_unit_id": 1, "establishment_id": null} | {"id": 1}     | {"type": "primary", "legal_unit_id": 1, "establishment_id": null} | during       | contains     | 2023-01-01     | 2026-01-01      | 2024-01-01     | 2025-01-01      | {"edit_at": "2025-10-07T03:56:18.001658-07:00", "valid_to": "2024-12-31", "category_id": 30, "edit_comment": "Test data load (315_activity_for_portion_of_valid.sql)", "data_source_id": null, "edit_by_user_id": 4} |          |       | existing_entity__1
           2 | {1}     | INSERT    |               | 1         | f             | {"id": 1, "type": "primary", "legal_unit_id": 1, "establishment_id": null} | {"id": 1}     | {"type": "primary", "legal_unit_id": 1, "establishment_id": null} | during       | finished_by  | 2023-01-01     | 2026-01-01      | 2025-01-01     | 2026-01-01      | {"edit_at": "2025-10-07T03:56:18.001658-07:00", "valid_to": "2025-12-31", "category_id": 13, "edit_comment": "Test data load (315_activity_for_portion_of_valid.sql)", "data_source_id": null, "edit_by_user_id": 4} |          |       | existing_entity__1
           3 | {1}     | UPDATE    | SHRINK        | 1         | f             | {"id": 1, "type": "primary", "legal_unit_id": 1, "establishment_id": null} | {"id": 1}     | {"type": "primary", "legal_unit_id": 1, "establishment_id": null} | during       | started_by   | 2023-01-01     | 2026-01-01      | 2023-01-01     | 2024-01-01      | {"edit_at": "2025-10-07T03:56:18.001658-07:00", "valid_to": "2023-12-31", "category_id": 13, "edit_comment": "Test data load (315_activity_for_portion_of_valid.sql)", "data_source_id": null, "edit_by_user_id": 4} |          |       | existing_entity__1
(3 rows)

SELECT category_id, valid_from, valid_to
 FROM activity
 ORDER BY  valid_from;
 category_id | valid_from |  valid_to  
-------------+------------+------------
          13 | 2023-01-01 | 2023-12-31
          30 | 2024-01-01 | 2024-12-31
          13 | 2025-01-01 | 2025-12-31
(3 rows)

ROLLBACK;
