BEGIN;
\i test/setup.sql
\echo -- test/setup.sql output suppressed for cleaner test output
-- test/setup.sql output suppressed for cleaner test output
\set ECHO none
\echo -- test/setup.sql done, test output follows
-- test/setup.sql done, test output follows
-- This test verifies directional change propagation:
-- 1. Full/unqualified refresh: no changed_* keys, all units processed
-- 2. Upward propagation scoping via changed_* keys in batch payloads:
--    ES change -> ES + parent LU + grandparent EN
--    LU change -> LU + parent EN (skip ES)
--    EN change -> EN only (skip LU + ES)
-- 3. Associated table changes (stat_for_unit, activity, location) propagate correctly
-- 4. Data correctness after each propagation
-- A Super User configures statbus.
CALL test.set_user_from_email('test.admin@statbus.org');
\i samples/demo/getting-started.sql
-- Set the activity category standard to ISIC v4 for the demo data.
\echo "User selected the Activity Category Standard"
"User selected the Activity Category Standard"
INSERT INTO settings(activity_category_standard_id,country_id,region_version_id)
SELECT (SELECT id FROM activity_category_standard WHERE code = 'isic_v4')
     , (SELECT id FROM public.country WHERE iso_2 = 'UN')
     , (SELECT id FROM public.region_version WHERE code = 'initial')
ON CONFLICT (only_one_setting)
DO UPDATE SET
    activity_category_standard_id = EXCLUDED.activity_category_standard_id,
    country_id = EXCLUDED.country_id,
    region_version_id = EXCLUDED.region_version_id;
\echo "User uploads the demo activity categories"
"User uploads the demo activity categories"
\copy public.activity_category_enabled_custom(path,name) FROM 'app/public/demo/activity_custom_isic_demo.csv' WITH (FORMAT csv, DELIMITER ',', QUOTE '"', HEADER true);
\echo "User uploads the demo regions"
"User uploads the demo regions"
\copy public.region_upload(path, name) FROM 'app/public/demo/regions_demo.csv' WITH (FORMAT csv, DELIMITER ',', QUOTE '"', HEADER true);
\echo "User uploads the demo sectors"
"User uploads the demo sectors"
\copy public.sector_custom_only(path,name,description) FROM 'app/public/demo/sectors_demo.csv' WITH (FORMAT csv, DELIMITER ',', QUOTE '"', HEADER true);
\echo "User uploads the demo legal forms"
"User uploads the demo legal forms"
\copy public.legal_form_custom_only(code,name) FROM 'app/public/demo/legal_forms_demo.csv' WITH (FORMAT csv, DELIMITER ',', QUOTE '"', HEADER true);
-- The demo data uses data sources that are part of the core database seed.
-- This file is included for structural consistency with other sample data sets.
-- Create Import Job for Legal Units (Demo CSV)
INSERT INTO public.import_job (definition_id, slug, description, note, edit_comment, time_context_ident)
SELECT
    (SELECT id FROM public.import_definition WHERE slug = 'legal_unit_job_provided'),
    'import_44_lu',
    'Import LU Demo CSV (344_directional_change_propagation.sql)',
    'Import job for legal_units_demo.csv',
    'Test data load (344)',
    'r_year_curr';
\echo "User uploads the sample legal units"
"User uploads the sample legal units"
\copy public.import_44_lu_upload(tax_ident,stat_ident,name,birth_date,physical_region_code,physical_country_iso_2,primary_activity_category_code,legal_form_code,sector_code,employees,turnover,data_source_code) FROM 'app/public/demo/legal_units_demo.csv' WITH (FORMAT csv, DELIMITER ',', QUOTE '"', HEADER true);
-- Create Import Job for Formal Establishments (Demo CSV)
INSERT INTO public.import_job (definition_id, slug, description, note, edit_comment, time_context_ident)
SELECT
    (SELECT id FROM public.import_definition WHERE slug = 'establishment_for_lu_job_provided'),
    'import_44_esflu',
    'Import Formal ES Demo CSV (344_directional_change_propagation.sql)',
    'Import job for formal_establishments_units_demo.csv',
    'Test data load (344)',
    'r_year_curr';
\echo "User uploads the sample formal establishments"
"User uploads the sample formal establishments"
\copy public.import_44_esflu_upload(tax_ident,stat_ident,name,physical_region_code,physical_country_iso_2,primary_activity_category_code,employees,turnover,legal_unit_tax_ident,data_source_code) FROM 'app/public/demo/formal_establishments_units_demo.csv' WITH (FORMAT csv, DELIMITER ',', QUOTE '"', HEADER true);
-- Create Import Job for Informal Establishments (Demo CSV)
INSERT INTO public.import_job (definition_id, slug, description, note, edit_comment, time_context_ident)
SELECT
    (SELECT id FROM public.import_definition WHERE slug = 'establishment_without_lu_job_provided'),
    'import_44_eswlu',
    'Import Informal ES Demo CSV (344_directional_change_propagation.sql)',
    'Import job for informal_establishments_units_demo.csv',
    'Test data load (344)',
    'r_year_curr';
\echo "User uploads the sample informal establishments"
"User uploads the sample informal establishments"
\copy public.import_44_eswlu_upload(tax_ident,stat_ident,name,physical_region_code,physical_country_iso_2,primary_activity_category_code,employees,turnover,data_source_code) FROM 'app/public/demo/informal_establishments_units_demo.csv' WITH (FORMAT csv, DELIMITER ',', QUOTE '"', HEADER true);
-- Create Import Job for Legal Relationships (Demo CSV)
INSERT INTO public.import_job (definition_id, slug, description, note, edit_comment, time_context_ident)
SELECT
    (SELECT id FROM public.import_definition WHERE slug = 'legal_relationship_job_provided'),
    'import_44_lr',
    'Import LR Demo CSV (344_directional_change_propagation.sql)',
    'Import job for legal_relationships_demo.csv',
    'Test data load (344)',
    'r_year_curr';
\echo "User uploads the sample legal relationships"
"User uploads the sample legal relationships"
\copy public.import_44_lr_upload(influencing_tax_ident,influenced_tax_ident,rel_type_code,percentage) FROM 'app/public/demo/legal_relationships_demo.csv' WITH (FORMAT csv, DELIMITER ',', QUOTE '"', HEADER true);
\echo Run worker processing for import jobs
Run worker processing for import jobs
CALL worker.process_tasks(p_queue => 'import');
\echo Run worker processing for analytics tasks (initial full refresh)
Run worker processing for analytics tasks (initial full refresh)
CALL worker.process_tasks(p_queue => 'analytics');
WARNING:  Error in before_procedure worker.notify_task_progress for task 418: worker.notify_task_progress() is not a procedure
WARNING:  Error in before_procedure worker.notify_task_progress for task 421: worker.notify_task_progress() is not a procedure
\echo "Baseline: statistical_unit counts by unit_type"
"Baseline: statistical_unit counts by unit_type"
SELECT unit_type, count(*) AS count
FROM public.statistical_unit
GROUP BY unit_type
ORDER BY unit_type;
   unit_type   | count 
---------------+-------
 establishment |    50
 legal_unit    |    23
 enterprise    |    48
 power_group   |     5
(4 rows)

--------------------------------------------------------------------------------
\echo "--- TEST 0: Full/unqualified refresh has NO changed_* keys (all units processed) ---"
"--- TEST 0: Full/unqualified refresh has NO changed_* keys (all units processed) ---"
--------------------------------------------------------------------------------
\echo "Initial full refresh ES/LU/EN batch should have no changed_* keys"
"Initial full refresh ES/LU/EN batch should have no changed_* keys"
SELECT
    payload->>'changed_establishment_id_ranges' AS changed_est,
    payload->>'changed_legal_unit_id_ranges' AS changed_lu,
    payload->>'changed_enterprise_id_ranges' AS changed_en
FROM worker.tasks
WHERE command = 'statistical_unit_refresh_batch'
  AND state = 'completed'
  AND payload ? 'enterprise_ids'
ORDER BY id LIMIT 1;
 changed_est | changed_lu | changed_en 
-------------+------------+------------
 {[1,51)}    | {[1,24)}   | {[1,49)}
(1 row)

\echo "Initial full refresh PG batch should have power_group_ids, no changed_* keys"
"Initial full refresh PG batch should have power_group_ids, no changed_* keys"
SELECT
    payload ? 'power_group_ids' AS has_pg_ids,
    payload ? 'enterprise_ids' AS has_ent_ids,
    payload->>'changed_establishment_id_ranges' AS changed_est
FROM worker.tasks
WHERE command = 'statistical_unit_refresh_batch'
  AND state = 'completed'
  AND payload ? 'power_group_ids' AND NOT (payload ? 'enterprise_ids')
ORDER BY id LIMIT 1;
 has_pg_ids | has_ent_ids | changed_est 
------------+-------------+-------------
 t          | f           | 
(1 row)

\echo "Clear completed tasks for clean slate"
"Clear completed tasks for clean slate"
DELETE FROM worker.tasks WHERE state = 'completed';
--------------------------------------------------------------------------------
\echo "--- TEST A: LU-only change (should propagate to LU + EN, skip ES) ---"
"--- TEST A: LU-only change (should propagate to LU + EN, skip ES) ---"
--------------------------------------------------------------------------------
\echo "Action: Updating legal_unit name"
"Action: Updating legal_unit name"
UPDATE public.legal_unit SET name = 'SSB Updated' WHERE name = 'Statistics Norway';
\echo "Check: Expect one collect_changes task"
"Check: Expect one collect_changes task"
SELECT command, state FROM worker.tasks WHERE command = 'collect_changes' AND state = 'pending';
     command     |  state  
-----------------+---------
 collect_changes | pending
(1 row)

\echo "Run analytics worker"
"Run analytics worker"
CALL worker.process_tasks(p_queue => 'analytics');
WARNING:  Error in before_procedure worker.notify_task_progress for task 570: worker.notify_task_progress() is not a procedure
WARNING:  Error in before_procedure worker.notify_task_progress for task 573: worker.notify_task_progress() is not a procedure
\echo "Task payload: changed_est should be empty, changed_lu and changed_en should have ranges"
"Task payload: changed_est should be empty, changed_lu and changed_en should have ranges"
SELECT
    payload->>'changed_establishment_id_ranges' AS changed_est,
    CASE WHEN (payload->>'changed_legal_unit_id_ranges')::int4multirange <> '{}'::int4multirange THEN 'has_ranges' END AS changed_lu,
    CASE WHEN (payload->>'changed_enterprise_id_ranges')::int4multirange <> '{}'::int4multirange THEN 'has_ranges' END AS changed_en
FROM worker.tasks
WHERE command = 'statistical_unit_refresh_batch'
  AND state = 'completed'
ORDER BY id DESC LIMIT 1;
 changed_est | changed_lu | changed_en 
-------------+------------+------------
 {}          | has_ranges | has_ranges
(1 row)

\echo "Verify: name updated in statistical_unit for LU"
"Verify: name updated in statistical_unit for LU"
SELECT name FROM public.statistical_unit
WHERE name = 'SSB Updated' AND unit_type = 'legal_unit'
AND valid_from <= current_date AND current_date < valid_until;
    name     
-------------
 SSB Updated
(1 row)

\echo "Verify: enterprise name also updated (upward propagation)"
"Verify: enterprise name also updated (upward propagation)"
SELECT name FROM public.statistical_unit
WHERE unit_type = 'enterprise'
  AND unit_id = (SELECT enterprise_id FROM public.legal_unit WHERE name = 'SSB Updated')
AND valid_from <= current_date AND current_date < valid_until;
    name     
-------------
 SSB Updated
(1 row)

\echo "Clean up for next test"
"Clean up for next test"
DELETE FROM worker.tasks WHERE state = 'completed';
--------------------------------------------------------------------------------
\echo "--- TEST B: ES-only change (should propagate to ES + parent LU) ---"
"--- TEST B: ES-only change (should propagate to ES + parent LU) ---"
--------------------------------------------------------------------------------
\echo "Action: Updating an establishment name (formal ES linked to a LU)"
"Action: Updating an establishment name (formal ES linked to a LU)"
UPDATE public.establishment SET name = 'ES Changed By Test'
WHERE id = (
    SELECT e.id FROM public.establishment AS e
    WHERE e.legal_unit_id IS NOT NULL
    ORDER BY e.id LIMIT 1
);
\echo "Check: Expect one collect_changes task"
"Check: Expect one collect_changes task"
SELECT command, state FROM worker.tasks WHERE command = 'collect_changes' AND state = 'pending';
     command     |  state  
-----------------+---------
 collect_changes | pending
(1 row)

\echo "Run analytics worker"
"Run analytics worker"
CALL worker.process_tasks(p_queue => 'analytics');
WARNING:  Error in before_procedure worker.notify_task_progress for task 637: worker.notify_task_progress() is not a procedure
WARNING:  Error in before_procedure worker.notify_task_progress for task 640: worker.notify_task_progress() is not a procedure
\echo "Task payload: changed_est and changed_lu should have ranges (ES propagates to parent LU via collect_changes)"
"Task payload: changed_est and changed_lu should have ranges (ES propagates to parent LU via collect_changes)"
SELECT
    CASE WHEN (payload->>'changed_establishment_id_ranges')::int4multirange <> '{}'::int4multirange THEN 'has_ranges' END AS changed_est,
    CASE WHEN (payload->>'changed_legal_unit_id_ranges')::int4multirange <> '{}'::int4multirange THEN 'has_ranges' END AS changed_lu,
    CASE WHEN (payload->>'changed_enterprise_id_ranges')::int4multirange <> '{}'::int4multirange THEN 'has_ranges' END AS changed_en
FROM worker.tasks
WHERE command = 'statistical_unit_refresh_batch'
  AND state = 'completed'
ORDER BY id DESC LIMIT 1;
 changed_est | changed_lu | changed_en 
-------------+------------+------------
 has_ranges  | has_ranges | 
(1 row)

\echo "Verify: establishment name updated in statistical_unit"
"Verify: establishment name updated in statistical_unit"
SELECT count(*) AS found FROM public.statistical_unit
WHERE name = 'ES Changed By Test' AND unit_type = 'establishment';
 found 
-------
     1
(1 row)

\echo "Clean up for next test"
"Clean up for next test"
DELETE FROM worker.tasks WHERE state = 'completed';
--------------------------------------------------------------------------------
\echo "--- TEST C: EN-only change (should propagate to EN only, skip LU + ES) ---"
"--- TEST C: EN-only change (should propagate to EN only, skip LU + ES) ---"
--------------------------------------------------------------------------------
\echo "Action: Updating enterprise short_name"
"Action: Updating enterprise short_name"
UPDATE public.enterprise SET short_name = 'SSB-EN'
WHERE id = (SELECT enterprise_id FROM public.legal_unit WHERE name = 'SSB Updated');
\echo "Check: Expect one collect_changes task"
"Check: Expect one collect_changes task"
SELECT command, state FROM worker.tasks WHERE command = 'collect_changes' AND state = 'pending';
     command     |  state  
-----------------+---------
 collect_changes | pending
(1 row)

\echo "Run analytics worker"
"Run analytics worker"
CALL worker.process_tasks(p_queue => 'analytics');
WARNING:  Error in before_procedure worker.notify_task_progress for task 688: worker.notify_task_progress() is not a procedure
WARNING:  Error in before_procedure worker.notify_task_progress for task 691: worker.notify_task_progress() is not a procedure
\echo "Task payload: only changed_enterprise_id_ranges should have ranges (EN only, skip LU + ES)"
"Task payload: only changed_enterprise_id_ranges should have ranges (EN only, skip LU + ES)"
SELECT
    payload->>'changed_establishment_id_ranges' AS changed_est,
    payload->>'changed_legal_unit_id_ranges' AS changed_lu,
    CASE WHEN (payload->>'changed_enterprise_id_ranges')::int4multirange <> '{}'::int4multirange THEN 'has_ranges' END AS changed_en
FROM worker.tasks
WHERE command = 'statistical_unit_refresh_batch'
  AND state = 'completed'
ORDER BY id DESC LIMIT 1;
 changed_est | changed_lu | changed_en 
-------------+------------+------------
 {}          | {}         | has_ranges
(1 row)

\echo "Verify: enterprise short_name updated in statistical_unit"
"Verify: enterprise short_name updated in statistical_unit"
SELECT name FROM public.statistical_unit
WHERE name = 'SSB-EN' AND unit_type = 'enterprise'
AND valid_from <= current_date AND current_date < valid_until;
  name  
--------
 SSB-EN
(1 row)

\echo "Clean up for next test"
"Clean up for next test"
DELETE FROM worker.tasks WHERE state = 'completed';
--------------------------------------------------------------------------------
\echo "--- TEST D: stat_for_unit change (LU-associated, propagates like LU change) ---"
"--- TEST D: stat_for_unit change (LU-associated, propagates like LU change) ---"
--------------------------------------------------------------------------------
\echo "Before: employees for SSB Updated"
"Before: employees for SSB Updated"
SELECT stats->'employees' AS employees FROM public.statistical_unit
WHERE name = 'SSB Updated' AND unit_type = 'legal_unit'
AND valid_from <= current_date AND current_date < valid_until;
          employees          
-----------------------------
 {"type": "int", "value": 1}
(1 row)

\echo "Action: Updating stat_for_unit (employees) for SSB Updated"
"Action: Updating stat_for_unit (employees) for SSB Updated"
UPDATE public.stat_for_unit SET value_int = 999
WHERE legal_unit_id = (SELECT id FROM public.legal_unit WHERE name = 'SSB Updated')
  AND stat_definition_id = (SELECT id FROM public.stat_definition WHERE code = 'employees');
\echo "Run analytics worker"
"Run analytics worker"
CALL worker.process_tasks(p_queue => 'analytics');
WARNING:  Error in before_procedure worker.notify_task_progress for task 755: worker.notify_task_progress() is not a procedure
WARNING:  Error in before_procedure worker.notify_task_progress for task 758: worker.notify_task_progress() is not a procedure
\echo "Task payload: should have changed_lu ranges (stat_for_unit is LU-associated)"
"Task payload: should have changed_lu ranges (stat_for_unit is LU-associated)"
SELECT
    payload->>'changed_establishment_id_ranges' AS changed_est,
    CASE WHEN (payload->>'changed_legal_unit_id_ranges')::int4multirange <> '{}'::int4multirange THEN 'has_ranges' END AS changed_lu,
    CASE WHEN (payload->>'changed_enterprise_id_ranges')::int4multirange <> '{}'::int4multirange THEN 'has_ranges' END AS changed_en
FROM worker.tasks
WHERE command = 'statistical_unit_refresh_batch'
  AND state = 'completed'
ORDER BY id DESC LIMIT 1;
 changed_est | changed_lu | changed_en 
-------------+------------+------------
 {}          | has_ranges | 
(1 row)

\echo "After: employees for SSB Updated (should be 999)"
"After: employees for SSB Updated (should be 999)"
SELECT stats->'employees' AS employees FROM public.statistical_unit
WHERE name = 'SSB Updated' AND unit_type = 'legal_unit'
AND valid_from <= current_date AND current_date < valid_until;
           employees           
-------------------------------
 {"type": "int", "value": 999}
(1 row)

\echo "Clean up for next test"
"Clean up for next test"
DELETE FROM worker.tasks WHERE state = 'completed';
--------------------------------------------------------------------------------
\echo "--- TEST E: activity change (LU-associated, propagates like LU change) ---"
"--- TEST E: activity change (LU-associated, propagates like LU change) ---"
--------------------------------------------------------------------------------
\echo "Before: primary_activity_category_path for SSB Updated"
"Before: primary_activity_category_path for SSB Updated"
SELECT primary_activity_category_path FROM public.statistical_unit
WHERE name = 'SSB Updated' AND unit_type = 'legal_unit'
AND valid_from <= current_date AND current_date < valid_until;
 primary_activity_category_path 
--------------------------------
 J.63.1.2.1
(1 row)

\echo "Action: Updating activity category for SSB Updated"
"Action: Updating activity category for SSB Updated"
UPDATE public.activity
SET category_id = (SELECT id FROM public.activity_category_enabled WHERE path = 'A.01')
WHERE legal_unit_id = (SELECT id FROM public.legal_unit WHERE name = 'SSB Updated')
  AND type = 'primary';
\echo "Run analytics worker"
"Run analytics worker"
CALL worker.process_tasks(p_queue => 'analytics');
WARNING:  Error in before_procedure worker.notify_task_progress for task 822: worker.notify_task_progress() is not a procedure
WARNING:  Error in before_procedure worker.notify_task_progress for task 825: worker.notify_task_progress() is not a procedure
\echo "Task payload: should have changed_lu ranges (activity is LU-associated)"
"Task payload: should have changed_lu ranges (activity is LU-associated)"
SELECT
    payload->>'changed_establishment_id_ranges' AS changed_est,
    CASE WHEN (payload->>'changed_legal_unit_id_ranges')::int4multirange <> '{}'::int4multirange THEN 'has_ranges' END AS changed_lu,
    CASE WHEN (payload->>'changed_enterprise_id_ranges')::int4multirange <> '{}'::int4multirange THEN 'has_ranges' END AS changed_en
FROM worker.tasks
WHERE command = 'statistical_unit_refresh_batch'
  AND state = 'completed'
ORDER BY id DESC LIMIT 1;
 changed_est | changed_lu | changed_en 
-------------+------------+------------
 {}          | has_ranges | 
(1 row)

\echo "After: primary_activity_category_path for SSB Updated (should be A.01)"
"After: primary_activity_category_path for SSB Updated (should be A.01)"
SELECT primary_activity_category_path FROM public.statistical_unit
WHERE name = 'SSB Updated' AND unit_type = 'legal_unit'
AND valid_from <= current_date AND current_date < valid_until;
 primary_activity_category_path 
--------------------------------
 A.01
(1 row)

\echo "Clean up for next test"
"Clean up for next test"
DELETE FROM worker.tasks WHERE state = 'completed';
--------------------------------------------------------------------------------
\echo "--- TEST F: location change (LU-associated, propagates like LU change) ---"
"--- TEST F: location change (LU-associated, propagates like LU change) ---"
--------------------------------------------------------------------------------
\echo "Before: physical_address_part1 for SSB Updated"
"Before: physical_address_part1 for SSB Updated"
SELECT physical_address_part1 FROM public.statistical_unit
WHERE name = 'SSB Updated' AND unit_type = 'legal_unit'
AND valid_from <= current_date AND current_date < valid_until;
 physical_address_part1 
------------------------
 
(1 row)

\echo "Action: Updating location address for SSB Updated"
"Action: Updating location address for SSB Updated"
UPDATE public.location SET address_part1 = '42 Test Street'
WHERE legal_unit_id = (SELECT id FROM public.legal_unit WHERE name = 'SSB Updated');
\echo "Run analytics worker"
"Run analytics worker"
CALL worker.process_tasks(p_queue => 'analytics');
WARNING:  Error in before_procedure worker.notify_task_progress for task 889: worker.notify_task_progress() is not a procedure
WARNING:  Error in before_procedure worker.notify_task_progress for task 892: worker.notify_task_progress() is not a procedure
\echo "Task payload: should have changed_lu ranges (location is LU-associated)"
"Task payload: should have changed_lu ranges (location is LU-associated)"
SELECT
    payload->>'changed_establishment_id_ranges' AS changed_est,
    CASE WHEN (payload->>'changed_legal_unit_id_ranges')::int4multirange <> '{}'::int4multirange THEN 'has_ranges' END AS changed_lu,
    CASE WHEN (payload->>'changed_enterprise_id_ranges')::int4multirange <> '{}'::int4multirange THEN 'has_ranges' END AS changed_en
FROM worker.tasks
WHERE command = 'statistical_unit_refresh_batch'
  AND state = 'completed'
ORDER BY id DESC LIMIT 1;
 changed_est | changed_lu | changed_en 
-------------+------------+------------
 {}          | has_ranges | 
(1 row)

\echo "After: physical_address_part1 for SSB Updated (should be 42 Test Street)"
"After: physical_address_part1 for SSB Updated (should be 42 Test Street)"
SELECT physical_address_part1 FROM public.statistical_unit
WHERE name = 'SSB Updated' AND unit_type = 'legal_unit'
AND valid_from <= current_date AND current_date < valid_until;
 physical_address_part1 
------------------------
 42 Test Street
(1 row)

--------------------------------------------------------------------------------
\echo "--- TEST G: LR change (should spawn PG-only batch with power_group_ids) ---"
"--- TEST G: LR change (should spawn PG-only batch with power_group_ids) ---"
--------------------------------------------------------------------------------
\echo "Baseline: power_group and legal_relationship counts"
"Baseline: power_group and legal_relationship counts"
SELECT count(*) AS power_group_count FROM public.power_group;
 power_group_count 
-------------------
                 5
(1 row)

SELECT count(*) AS lr_count FROM public.legal_relationship;
 lr_count 
----------
       11
(1 row)

\echo "Action: Updating a legal_relationship percentage"
"Action: Updating a legal_relationship percentage"
UPDATE public.legal_relationship SET percentage = 99
WHERE id = (SELECT id FROM public.legal_relationship ORDER BY id LIMIT 1);
\echo "Check: Expect one collect_changes task"
"Check: Expect one collect_changes task"
SELECT command, state FROM worker.tasks WHERE command = 'collect_changes' AND state = 'pending';
     command     |  state  
-----------------+---------
 collect_changes | pending
(1 row)

\echo "Run analytics worker"
"Run analytics worker"
CALL worker.process_tasks(p_queue => 'analytics');
WARNING:  Error in before_procedure worker.notify_task_progress for task 956: worker.notify_task_progress() is not a procedure
WARNING:  Error in before_procedure worker.notify_task_progress for task 959: worker.notify_task_progress() is not a procedure
\echo "Task payload: PG batch should have power_group_ids but no enterprise_ids"
"Task payload: PG batch should have power_group_ids but no enterprise_ids"
SELECT
    payload ? 'power_group_ids' AS has_pg_ids,
    payload ? 'enterprise_ids' AS has_ent_ids
FROM worker.tasks
WHERE command = 'statistical_unit_refresh_batch'
  AND state = 'completed'
  AND payload ? 'power_group_ids' AND NOT (payload ? 'enterprise_ids')
ORDER BY id DESC LIMIT 1;
 has_pg_ids | has_ent_ids 
------------+-------------
 t          | f
(1 row)

\echo "Clean up for next test"
"Clean up for next test"
DELETE FROM worker.tasks WHERE state = 'completed';
--------------------------------------------------------------------------------
\echo "--- TEST H: PG metadata change (should spawn PG-only batch) ---"
"--- TEST H: PG metadata change (should spawn PG-only batch) ---"
--------------------------------------------------------------------------------
\echo "Action: Updating power_group short_name"
"Action: Updating power_group short_name"
UPDATE public.power_group SET short_name = 'PG-TEST'
WHERE id = (SELECT id FROM public.power_group ORDER BY id LIMIT 1);
\echo "Check: Expect one collect_changes task"
"Check: Expect one collect_changes task"
SELECT command, state FROM worker.tasks WHERE command = 'collect_changes' AND state = 'pending';
     command     |  state  
-----------------+---------
 collect_changes | pending
(1 row)

\echo "Run analytics worker"
"Run analytics worker"
CALL worker.process_tasks(p_queue => 'analytics');
WARNING:  Error in before_procedure worker.notify_task_progress for task 1792: worker.notify_task_progress() is not a procedure
WARNING:  Error in before_procedure worker.notify_task_progress for task 1795: worker.notify_task_progress() is not a procedure
\echo "Task payload: PG batch should have power_group_ids but no enterprise_ids"
"Task payload: PG batch should have power_group_ids but no enterprise_ids"
SELECT
    payload ? 'power_group_ids' AS has_pg_ids,
    payload ? 'enterprise_ids' AS has_ent_ids
FROM worker.tasks
WHERE command = 'statistical_unit_refresh_batch'
  AND state = 'completed'
  AND payload ? 'power_group_ids' AND NOT (payload ? 'enterprise_ids')
ORDER BY id DESC LIMIT 1;
 has_pg_ids | has_ent_ids 
------------+-------------
 t          | f
(1 row)

\echo "Clean up for next test"
"Clean up for next test"
DELETE FROM worker.tasks WHERE state = 'completed';
--------------------------------------------------------------------------------
\echo "--- TEST I: PR change (custom_root override, should spawn PG-only batch) ---"
"--- TEST I: PR change (custom_root override, should spawn PG-only batch) ---"
--------------------------------------------------------------------------------
-- The demo LR data has only simple trees (1 natural root per PG), so
-- process_power_group_link creates 0 power_root rows.  We need a cycle
-- (0 natural roots) to produce power_root rows for testing.
-- Create two fresh LUs with a mutual ownership cycle (A->B, B->A).
\echo "Step 1: Import two new LUs for cycle test"
"Step 1: Import two new LUs for cycle test"
INSERT INTO public.import_job (definition_id, slug, description, note, edit_comment, time_context_ident)
SELECT
    (SELECT id FROM public.import_definition WHERE slug = 'legal_unit_job_provided'),
    'import_44_lu_cycle',
    'Import cycle LUs (344)',
    'Cycle LUs',
    'Test 344 cycle',
    'r_year_curr';
\copy public.import_44_lu_cycle_upload(tax_ident,stat_ident,name,birth_date,physical_region_code,physical_country_iso_2,primary_activity_category_code,legal_form_code,sector_code,employees,turnover,data_source_code) FROM stdin WITH (FORMAT csv, DELIMITER ',', QUOTE '"', HEADER true)
\echo "Step 2: Import mutual LRs to create cycle (A->B and B->A)"
"Step 2: Import mutual LRs to create cycle (A->B and B->A)"
INSERT INTO public.import_job (definition_id, slug, description, note, edit_comment, time_context_ident)
SELECT
    (SELECT id FROM public.import_definition WHERE slug = 'legal_relationship_job_provided'),
    'import_44_lr_cycle',
    'Import cycle LRs (344)',
    'Cycle LRs',
    'Test 344 cycle',
    'r_year_curr';
\copy public.import_44_lr_cycle_upload(influencing_tax_ident,influenced_tax_ident,rel_type_code,percentage) FROM stdin WITH (FORMAT csv, DELIMITER ',', QUOTE '"', HEADER true)
\echo "Step 3: Process imports and analytics"
"Step 3: Process imports and analytics"
CALL worker.process_tasks(p_queue => 'import');
CALL worker.process_tasks(p_queue => 'analytics');
WARNING:  Error in before_procedure worker.notify_task_progress for task 2720: worker.notify_task_progress() is not a procedure
WARNING:  Error in before_procedure worker.notify_task_progress for task 2723: worker.notify_task_progress() is not a procedure
DELETE FROM worker.tasks WHERE state = 'completed';
\echo "Check: power_root rows exist after cycle creation"
"Check: power_root rows exist after cycle creation"
SELECT count(*) AS pr_count FROM public.power_root;
 pr_count 
----------
        1
(1 row)

\echo "Action: Setting custom_root on a power_root row (NSO override)"
"Action: Setting custom_root on a power_root row (NSO override)"
UPDATE public.power_root
SET custom_root_legal_unit_id = derived_root_legal_unit_id
WHERE id = (SELECT id FROM public.power_root ORDER BY id LIMIT 1);
\echo "Check: Expect one collect_changes task"
"Check: Expect one collect_changes task"
SELECT command, state FROM worker.tasks WHERE command = 'collect_changes' AND state = 'pending';
     command     |  state  
-----------------+---------
 collect_changes | pending
(1 row)

\echo "Run analytics worker"
"Run analytics worker"
CALL worker.process_tasks(p_queue => 'analytics');
WARNING:  Error in before_procedure worker.notify_task_progress for task 2789: worker.notify_task_progress() is not a procedure
WARNING:  Error in before_procedure worker.notify_task_progress for task 2792: worker.notify_task_progress() is not a procedure
\echo "Task payload: PG batch should have power_group_ids but no enterprise_ids"
"Task payload: PG batch should have power_group_ids but no enterprise_ids"
SELECT
    payload ? 'power_group_ids' AS has_pg_ids,
    payload ? 'enterprise_ids' AS has_ent_ids
FROM worker.tasks
WHERE command = 'statistical_unit_refresh_batch'
  AND state = 'completed'
  AND payload ? 'power_group_ids' AND NOT (payload ? 'enterprise_ids')
ORDER BY id DESC LIMIT 1;
 has_pg_ids | has_ent_ids 
------------+-------------
 t          | f
(1 row)

\echo "Clean up for next test"
"Clean up for next test"
DELETE FROM worker.tasks WHERE state = 'completed';
--------------------------------------------------------------------------------
\echo "--- TEST J: LU migration between enterprises (connect_legal_unit_to_enterprise) ---"
"--- TEST J: LU migration between enterprises (connect_legal_unit_to_enterprise) ---"
--------------------------------------------------------------------------------
-- Moving a LU between enterprises should propagate changes to both old and new EN.
\echo "Step 1: Identify two LUs in different enterprises"
"Step 1: Identify two LUs in different enterprises"
-- Use SSB Updated (already modified in earlier tests) and another LU
SELECT lu.id AS lu_id, lu.name, lu.enterprise_id
FROM public.legal_unit AS lu
WHERE lu.name = 'SSB Updated'
AND lu.valid_from <= current_date AND current_date < lu.valid_until;
 lu_id |    name     | enterprise_id 
-------+-------------+---------------
    15 | SSB Updated |            22
(1 row)

-- Pick a target enterprise different from SSB Updated's enterprise
SELECT lu2.enterprise_id AS target_enterprise_id
FROM public.legal_unit AS lu2
WHERE lu2.enterprise_id != (SELECT enterprise_id FROM public.legal_unit WHERE name = 'SSB Updated' LIMIT 1)
  AND lu2.valid_from <= current_date AND current_date < lu2.valid_until
ORDER BY lu2.id
LIMIT 1;
 target_enterprise_id 
----------------------
                    1
(1 row)

-- Drop leftover temp tables from temporal_merge (created by SECURITY DEFINER
-- import functions as postgres; current role can't drop them)
RESET ROLE;
DROP TABLE IF EXISTS pg_temp.temporal_merge_plan;
DROP TABLE IF EXISTS pg_temp.temporal_merge_feedback;
DROP TABLE IF EXISTS pg_temp.temporal_merge_entity_id_map;
NOTICE:  table "temporal_merge_entity_id_map" does not exist, skipping
DROP TABLE IF EXISTS pg_temp.temporal_merge_index_cache;
CALL test.set_user_from_email('test.admin@statbus.org');
\echo "Step 2: Move SSB Updated to the target enterprise"
"Step 2: Move SSB Updated to the target enterprise"
SELECT connect_legal_unit_to_enterprise(
    legal_unit_id := lu.id,
    enterprise_id := target_en.enterprise_id
)
FROM public.legal_unit AS lu
CROSS JOIN (
    SELECT lu2.enterprise_id
    FROM public.legal_unit AS lu2
    WHERE lu2.enterprise_id != (SELECT enterprise_id FROM public.legal_unit WHERE name = 'SSB Updated' LIMIT 1)
      AND lu2.valid_from <= current_date AND current_date < lu2.valid_until
    ORDER BY lu2.id LIMIT 1
) AS target_en
WHERE lu.name = 'SSB Updated'
  AND lu.valid_from <= current_date AND current_date < lu.valid_until;
                                         connect_legal_unit_to_enterprise                                         
------------------------------------------------------------------------------------------------------------------
 {"new_enterprise_id": 1, "old_enterprise_id": 22, "deleted_enterprise_id": null, "updated_legal_unit_ids": [15]}
(1 row)

\echo "Check: Expect one collect_changes task"
"Check: Expect one collect_changes task"
SELECT command, state FROM worker.tasks WHERE command = 'collect_changes' AND state = 'pending';
     command     |  state  
-----------------+---------
 collect_changes | pending
(1 row)

\echo "Run analytics worker"
"Run analytics worker"
CALL worker.process_tasks(p_queue => 'analytics');
WARNING:  Error in before_procedure worker.notify_task_progress for task 3644: worker.notify_task_progress() is not a procedure
WARNING:  Error in before_procedure worker.notify_task_progress for task 3647: worker.notify_task_progress() is not a procedure
\echo "Task payload: should have changed_lu and changed_en ranges (LU moved between enterprises)"
"Task payload: should have changed_lu and changed_en ranges (LU moved between enterprises)"
SELECT
    payload->>'changed_establishment_id_ranges' AS changed_est,
    CASE WHEN (payload->>'changed_legal_unit_id_ranges')::int4multirange <> '{}'::int4multirange THEN 'has_ranges' END AS changed_lu,
    CASE WHEN (payload->>'changed_enterprise_id_ranges')::int4multirange <> '{}'::int4multirange THEN 'has_ranges' END AS changed_en
FROM worker.tasks
WHERE command = 'statistical_unit_refresh_batch'
  AND state = 'completed'
  AND payload ? 'enterprise_ids'
ORDER BY id DESC LIMIT 1;
 changed_est | changed_lu | changed_en 
-------------+------------+------------
 {}          | has_ranges | has_ranges
(1 row)

\echo "Verify: SSB Updated now in new enterprise (no longer in the SSB-EN enterprise)"
"Verify: SSB Updated now in new enterprise (no longer in the SSB-EN enterprise)"
SELECT lu.name, lu.enterprise_id != (SELECT en.id FROM public.enterprise AS en WHERE en.short_name = 'SSB-EN') AS moved_away
FROM public.legal_unit AS lu
WHERE lu.name = 'SSB Updated'
  AND lu.valid_from <= current_date AND current_date < lu.valid_until;
    name     | moved_away 
-------------+------------
 SSB Updated | t
(1 row)

\echo "Clean up for next test"
"Clean up for next test"
DELETE FROM worker.tasks WHERE state = 'completed';
ROLLBACK;
